,cast
3649,JakeGyllenhaal JenaMalone PatrickSwayze MaggieGyllenhaal
3650,JoaquínCosio GerardoTaracena JaimeCamil MiguelRodarte
3651,JanDecleir FedjavanHuêt BettySchuurman TamarvandenDop
3652,JasonSchwartzman MickeyRourke BrittanyMurphy JohnLeguizamo
3653,AllySheedy PaulReubens ShirleyHenderson AllisonJanney
3654,MarieFéret MarcBarbé DelphineChuillot DavidMoreau
3655,VinnieJones DavidKelly DavidHemmings RalphBrown
3656,SamShepard MagalySolier EduardoNoriega StephenRea
3657,OksanaAkinshina ArtyomBogucharsky LyubovAgapova LiliyaShinkaryova
3658,LiamNeeson JustinLong ChristinaRicci JoshCharles
3659,JimmyShergill MohitMarwah KiaraAdvani VijendarSingh
3660,JackNicholson LouiseFletcher DannyDeVito WilliamRedfield
3661,DoveCameron KatherineMcNamara RyanMcCartan LaineMacNeil
3662,MelBrooks MartyFeldman DomDeLuise SidCaesar
3663,AkshayKumar NimratKaur FerynaWazheir Lena
3664,MeganFollows ColleenDewhurst RichardFarnsworth PatriciaHamilton
3665,MichaelJaiWhite NealMcDonough LateefCrowder LailaAli
3666,RayWinstone BenDrew HayleyAtwell DamianLewis
3667,RayWinstone BenKingsley IanMcShane AmandaRedman
3668,JoelKinnaman MatiasVarela DragomirMrsic LisaHenni
3669,KeishaCastle-Hughes RawiriParatene VickyHaughton CliffCurtis
3670,AmitabhBachchan AbhishekBachchan VidyaBalan PareshRawal
3671,MartinRapold Anna-KatharinaSchwabroh RegulaGrauwiller YangzomBrauen
3672,ZacEfron VanessaHudgens AshleyTisdale LucasGrabeel
3673,JohnHurt JasonPriestley SheilaHancock MauryChaykin
3674,StephenRea JayeDavidson MirandaRichardson ForestWhitaker
3675,DanMonahan MarkHerrier WyattKnight CyrilO'Reilly
3676,AlanvanSprang KennethWelsh KathleenMunroe DevonBostick
3677,DuaneJones JudithO'Dea KarlHardman MarilynEastman
3678,BillMurray ScarlettJohansson AnnaFaris GiovanniRibisi
3679,WoodyAllen DianeKeaton TonyRoberts CarolKane
3680,BettyHutton CornelWilde CharltonHeston DorothyLamour
3681,HalleBerry BillyBobThornton HeathLedger SeanCombs
3682,ArnoldSchwarzenegger AbigailBreslin JoelyRichardson DouglasM.Griffin
3683,NicolasCage ElisabethShue JulianSands RichardLewis
3684,MollyC.Quinn MichaelWelch LaraFlynnBoyle CaryElwes
3685,JackLemmon WalterMatthau SusanSarandon VincentGardenia
3686,JenniferLopez RyanGuzman IanNelson JohnCorbett
3687,BurtLancaster TonyCurtis GinaLollobrigida KatyJurado
3688,JulianneMoore AnnetteBening MarkRuffalo MiaWasikowska
3689,RoddyPiper KeithDavid MegFoster GeorgeBuckFlower
3690,SteveMcQueen JamesGarner RichardAttenborough JamesDonald
3691,AshleyBell JuliaGarner AndrewSensenig SpencerTreatClark
3692,EllarColtrane PatriciaArquette EthanHawke ElijahSmith
3693,ScarlettJohansson HughJackman WoodyAllen IanMcShane
3694,Dr.Dre SnoopDogg DJPooh AngellConwell
3695,BrianHooks N'BusheWright FaizonLove E-40
3696,WilliamH.Macy AlecBaldwin MariaBello ShawnHatosy
3697,ClarkGable MarilynMonroe MontgomeryClift ThelmaRitter
3698,ToniCollette RobinWilliams JoeMorton BobbyCannavale
3699,JohnG.Brennan KamalAhmed AlanArkin WilliamHickey
3700,BelénRueda FernandoCayo RogerPríncep MabelRivera
3701,MarlonWayans JaimePressly EssenceAtkins GabrielIglesias
3702,JamesVanDerBeek ShannynSossamon IanSomerhalder JessicaBiel
3703,FrederickStafford DanyRobin ClaudeJade MichelSubor
3704,DaxShepard WillArnett ChiMcBride DavidKoechner
3705,TimRoth AntonioBanderas JenniferBeals Madonna
3706,JamesSpader MaggieGyllenhaal JeremyDavies LesleyAnnWarren
3707,LauraRamsey   
3708,EricBogosian EllenGreene LeslieHope JohnC.McGinley
3709,ChristopherGuest EugeneLevy FredWillard CatherineO'Hara
3710,FrenchStewart BridgetteWilson BillBellamy TyraBanks
3711,BenKingsley TéaLeoni LukeWilson BillPullman
3712,LouTaylorPucci TildaSwinton VincentD'Onofrio KeanuReeves
3713,MichaelParks JohnGoodman MelissaLeo MichaelAngarano
3714,StephanieLeonidas JasonBarry RobBrydon GinaMcKee
3715,MarcosLuna PutuDindaPratika PutiSriCandraDewi NiMadeMegahadiPratiwi
3716,PeterPaul DavidPaul RichardLynch EvaLaRue
3717,FreddieHighmore EmmaRoberts MichaelAngarano ElizabethReaser
3718,PatrickWilson LenaHeadey RichardDreyfuss RayWinstone
3719,RickySchroder ChazzPalminteri RodSteiger MichaelRosenbaum
3720,JulianSands SaffronBurrows JustinChadwick StefanoDionisi
3721,EvaMendes KylieMinogue MichelPiccoli EdithScob
3722,NicolasCage TyeSheridan RonnieGeneBlevins SueRock
3723,DanFutterman StuartTownsend KateBeckinsale RowenaCooper
3724,ViggoMortensen ChelseaField LaneSmith LincolnKilpatrick
3725,LaurenAmbrose NicholasBrendon AmyAdams CharlesBusch
3726,CraigFerguson DavidRasche MaryMcCormack DonalLogue
3727,AdrianaBarraza RüdigerEvers HectorKotsifakis FranziskaKruse
3728,CliveOwen CatherineKeener LianaLiberato JasonClarke
3729,BarryMcEvoy BríanF.O'Byrne AnnaFriel PaulineMcLynn
3730,PetePostlethwaite RachelGriffiths AndySerkis LennieJames
3731,NaomiWatts RobinWright XavierSamuel JamesFrecheville
3732,VincentD'Onofrio SalmaHayek ThomasJane Oliviad'Abo
3733,JavierBardem LuisTosar NievedeMedina EnriqueVillén
3734,DanielleHarris KellyMcGillis NickDamici ConnorPaolo
3735,ThomasJane KeanuReeves ClaireForlani GretchenMol
3736,WagnerMoura ClemensSchick JesuítaBarbosa SabineTimoteo
3737,EllenBarkin EzraMiller KateBosworth DemiMoore
3738,MelissaGeorge EdSpeleers EamonnWalker AlecNewman
3739,DavidHewlett AndrewMiller GordonPinsent Marie-JoséeCroze
3740,KonstantinKhabenskiy ElenaLyadova AleksandrRobak EvgeniyaKhirivskaya
3741,WilliamDaniels HowardDaSilva KenHoward BlytheDanner
3742,AlexanderSiddig JoshuaJackson MarisaTomei OdedFehr
3743,BenLyon JamesHall JeanHarlow JohnDarrow
3744,SelmaBlair PatrickWilson EdwardBurns DebraMessing
3745,JessicaAlba ThomasJane LilyRabe ShannonWoodward
3746,XavierSamuel JessicaMcNamee RobinMcLeavy VictoriaThaine
3747,KristenQuintrall DenyceLawton JoJoWright RachelSterling
3748,BrookeD'Orsay EricMabius JodyThompson GinaHolden
3749,ScottEastwood CherylLadd PatrickLyster RachelHendrix
3750,PaulScofield WendyHiller LeoMcKern RobertShaw
3751,FayeDunaway WilliamHolden PeterFinch RobertDuvall
3752,VivienLeigh ClarkGable OliviadeHavilland ThomasMitchell
3753,FreidaPinto ReeceRitchie TomCullen NazaninBoniadi
3754,CharltonHeston RichardHarris JimHutton JamesCoburn
3755,BettyHutton HowardKeel LouisCalhern J.CarrolNaish
3756,RizAhmed NigelLindsay KayvanNovak AdeelAkhtar
3757,FernandaMontenegro RuyGuerra FernandaTorres SeuJorge
3758,WoodyHarrelson KatDennings EliasKoteas SandraOh
3759,JudyGarland GeneKelly WalterSlezak GladysCooper
3760,BrianCox PaulDano StephanieSzostak IsildLeBesco
3761,SamuelAnderson DominicCooper JamesCorden SamuelBarnett
3762,DustinHoffman JonVoight SylviaMiles JohnMcGiver
3763,RobertCarlyle MarkAddy WilliamSnape SteveHuison
3764,RobertHays JulieHagerty KareemAbdul-Jabbar LloydBridges
3765,MichaelJaiWhite SteveAustin MaxRyan AllenYates
3766,IceCube ChrisTucker NiaLong TomListerJr.
3767,TyrinTurner LarenzTate GlennPlummer JadaPinkettSmith
3768,GeorgeKennedy DorothyLamour LoisChiles TomSavini
3769,JasonRobards StellaStevens DavidWarner SlimPickens
3770,RobertBlake ScottWilson JohnForsythe PaulStewart
3771,AudreyHepburn PeterFinch PeggyAshcroft DeanJagger
3772,PaulNewman LaurenBacall JulieHarris ArthurHill
3773,JonFinch AlecMcCowen BarryFoster BillieWhitelaw
3774,AnyaTaylor-Joy RalphIneson KateDickie HarveyScrimshaw
3775,MasterP AnthonyJohnson IceCube TomListerJr.
3776,EdwardBurns MichaelMcGlone CameronDiaz JenniferAniston
3777,IanMcKellen BrendanFraser LynnRedgrave LolitaDavidovich
3778,RicardoDarín SoledadVillamil PabloRago JavierGodino
3779,ThoraBirch GideonEmery GloriaVotsis DerekMagyar
3780,BruceCampbell SarahBerry DanHicks KassieDePaiva
3781,JenniferCoolidge LanceCrouther J.B.Smoove RegE.Cathey
3782,IanZiering TaraReid CassandraScerbo JohnHeard
3783,DamiánDelgado JoséCarlosRodríguez ElpidiaCarrillo IñakiAierra
3784,OttoJespersen HansMortenHansen TomasAlfLarsen JohannaMørck
3785,ChrisMessina JenniferWestfeldt DavidMargulies KaliRocha
3786,ZooeyDeschanel WillFerrell EdHarris AmyMadigan
3787,SaraFoster MeaganGood JordanaBrewster DevonAoki
3788,BrettGranstaff LaraJeanChorostecki T.J.McGibbon DiahannCarroll
3789,MelissaGeorge OdedFehr ChristianCampbell AliceKrige
3790,JoePantoliano WadeDominguez ElizabethBerkley MichaelChiklis
3791,JamesNesbitt GenevieveO'Reilly JasonWatkins LauraPyper
3792,MarkThompson MarkPellegrino TeriPolo KevinPollak
3793,PeterWeller ArielWinter DavidSelby MichaelEmerson
3794,OscarIsaac JaneGoodall JerryBrown NealBarnard
3795,DominicPurcell RalitsaPaskaleva BasharRahal NikolaiSotirov
3796,AbigailBreslin JamesPurefoy SeanBean AlexaPenaVega
3797,ScottEastwood RitaWilson JeffFahey DavidJamesElliott
3798,GlenMurphy RayWinstone GiovanniCapalbo SerenaIansiti
3799,MelBrooks MadelineKahn ClorisLeachman HarveyKorman
3800,MorganFreeman CharlesBerling RomaneBohringer JulesSitruk
3801,KevinSpacey PaulBettany JeremyIrons ZacharyQuinto
3802,MurrayBartlett DanielDugan AdrianGonzalez 
3803,SamRockwell AnjelicaHuston KellyMacdonald BradWilliamHenke
3804,MilesTeller J.K.Simmons MelissaBenoist AustinStowell
3805,AlexandreRodrigues LeandroFirmino PhellipeHaagensen DouglasSilva
3806,JohnSimm DannyDyer LorrainePilkington ShaunParkes
3807,KatDennings ChadMichaelMurray RupertFriend CorbinBleu
3808,BrittanyMurphy ToniCollette RoseByrne JoshBrolin
3809,MadsMikkelsen AlexandraRapaport ThomasBoLarsen AnneLouiseHassing
3810,MelindaDillon DarrenMcGavin PeterBillingsley JeanShepherd
3811,TammyBlanchard AngélicaAragón AliLandry JaimeTirelli
3812,PerryKing MerrieLynnRoss TimVanPatten MichaelJ.Fox
3813,MenaSuvari EricRoberts KristinChenoweth DanaAshbrook
3814,RupertGraves SamanthaMorton NicholasWoodeson LeeRoss
3815,FrançoisBégaudeau FranckKeïta EsmeraldaOuertani RachelRegulier
3816,MiaFarrow JohnCassavetes RuthGordon SidneyBlackmer
3817,JohnWayne JamesStewart VeraMiles LeeMarvin
3818,HughDancy RoseByrne PeterGallagher AmyIrving
3819,CatalinaSandinoMoreno GuiliedLopez YennyPaolaVega JohnÁlexToro
3820,EwanMcGregor ChristopherPlummer MélanieLaurent GoranVisnjic
3821,BalthazarGetty HenryRollins NaviRawat JudahFriedlander
3822,JohnBelushi TimMatheson JohnVernon VernaBloom
3823,SeanConnery HonorBlackman GertFröbe ShirleyEaton
3824,CalebLandryJones SarahGadon MalcolmMcDowell JoePingue
3825,JamesStewart DonnaReed LionelBarrymore ThomasMitchell
3826,EwanMcGregor EwenBremner JonnyLeeMiller RobertCarlyle
3827,SteveHarvey D.L.Hughley CedrictheEntertainer BernieMac
3828,KatieFeatherston DavidBierend BrianBoland MollyEphraim
3829,IanBannen DavidKelly FionnulaFlanagan SusanLynch
3830,MichaelMoore GeorgeH.W.Bush GeorgeW.Bush DickClark
3831,RobertEnglund MarkPatton KimMyers RobertRusler
3832,MaggieSmith HelenaBonhamCarter DenholmElliott JulianSands
3833,LenaHeadey EthanHawke MaxBurkholder AdelaideKane
3834,EthanHawke JulietRylance VincentD'Onofrio JamesRansone
3835,MartinLawrence   
3836,ElizabethTaylor PaulNewman BurlIves JudithAnderson
3837,JamesFranciscus KimHunter MauriceEvans LindaHarrison
3838,KevinZegers WendyMakkena MichaelJeter BillCobbs
3839,VeronicaTaylor RachaelLillis EricStuart 
3840,ThomMathews JenniferCooke DavidKagen RenéeJones
3841,WilliamHolden AlecGuinness JackHawkins SessueHayakawa
3842,ArianaRichards DouglasBarr RoyalDano WilliamHolmes
3843,BarbaraHarris BruceDern KarenBlack WilliamDevane
3844,JackLemmon ShirleyMacLaine FredMacMurray RayWalston
3845,KaneHodder JohnD.LeMay KariKeegan StevenWilliams
3846,PaulNewman JulieAndrews LilaKedrova HansjörgFelmy
3847,DaveChappelle ErykahBadu Common YasiinBey
3848,MichaelFassbender KodiSmit-McPhee BenMendelsohn CarenPistorius
3849,BlairUnderwood JosephSimmons DarrylMcDaniels SheilaE.
3850,DonaldFaison MikeEpps WoodHarris OmariHardwick
3851,BurtLancaster JeanSimmons ArthurKennedy DeanJagger
3852,SpencerTracy BurtLancaster RichardWidmark MarleneDietrich
3853,DeonRichmond DonaldFaison GuyTorry MaiaCampbell
3854,JohnWayne MontgomeryClift JoanneDru WalterBrennan
3855,Mo'Nique JimmyJean-Louis Godfrey JoyfulDrake
3856,EthanHawke JulieDelpy SeamusDavey-Fitzpatrick JenniferPrior
3857,JasonBateman KimDarby JohnAstin MarkHolton
3858,JamesLeGros ReggieBannister AngusScrimm PaulaIrvine
3859,KimberlyElise LorettaDevine DebbiMorgan MichaelBoatman
3860,AmericaFerrera LupeOntiveros IngridOliu GeorgeLopez
3861,LisaRay Sarala JohnAbraham SeemaBiswas
3862,OmPuri LindaBassett IanAspinall JimiMistry
3863,AmandaPeet BrianVanHolt JonathanAbrahams ZorieBarber
3864,IndiraVarma SaritaChoudhury RamonTikaram NaveenAndrews
3865,RebeccaHall CatherineKeener AmandaPeet OliverPlatt
3866,GeneWilder JackAlbertson PeterOstrum RoyKinnear
3867,JulianSands ChrisYoung PaulaMarshall JoannaPacula
3868,JoePesci KristySwanson GeorgeHamilton DyanCannon
3869,RichardGere BrookeAdams LindaManz SamShepard
3870,JohnTurturro CleaDuVall MatthewMcConaughey AmyIrving
3871,RoseMcGowan JulieBenz RebeccaGayheart CarolKane
3872,JeffreyWright DavidBowie DennisHopper GaryOldman
3873,GretaGerwig MickeySumner AdamDriver MichaelZegen
3874,PresleyChweneyagae JerryMofokeng TerryPheto KennethNkosi
3875,JaneAdams JonLovitz PhilipSeymourHoffman DylanBaker
3876,EddieGriffin JoeHoward MatthewBrent RobertNoble
3877,MichaelParks JustinLong HaleyJoelOsment GénesisRodríguez
3878,RobynLively JeffreyJohnson BaileeMadison MareeCheatham
3879,RutgerHauer GregorySmith RobbWells BrianDowney
3880,OmarChaparro JoeyMorgan AislinnDerbez EricRoberts
3881,KieferSutherland ReeseWitherspoon WolfgangBodison DanHedaya
3882,ErinCottrell LoganBartholomew WilliamMorganSheppard JamesTupper
3883,KatieJarvis MichaelFassbender KierstonWareing RebeccaGriffiths
3884,GretaGerwig CarrieMacLemore MegalynEchikunwoke AnaleighTipton
3885,CraigT.Nelson KimCattrall ColmFeore CressWilliams
3886,KirstenDunst IslaFisher LizzyCaplan RebelWilson
3887,VirginiaMadsen LindseyHaun BarbaraMamabolo JohnRalston
3888,EricWareheim TimHeidecker JohnC.Reilly ZachGalifianakis
3889,RobertStadlober KostjaUllmann AlicjaBachleda-Curuś JürgenTonkel
3890,EricStoltz KateConnor LyndsyFonseca AndyHirsch
3891,NikkiReed KeithDavid BradDourif BetsyRussell
3892,GretchenMol PattiLuPone PeterOnorati RyanMerriman
3893,LaurenGerman MichaelBiehn MiloVentimiglia CourtneyB.Vance
3894,CiaránHinds AidanQuinn IbenHjejle JimNorton
3895,MariaBello FrankGrillo CodyHorn DustinMilligan
3896,PagetBrewster NeilBarton EricHoffman DarrenKeefe
3897,NicholasTurturro TaliaShire PaulRodríguez GaryValentine
3898,RooneyMara GeorgiaKing BrieLarson AmyFerguson
3899,CamillaBelle AndyGarcía ColinEgglesfield JulietteLewis
3900,PaulRudd AmyPoehler BillHader EllieKemper
3901,KathrynFiore FlipSchultz OliviaAlexander ArturodelPuerto
3902,StaceyAsaro GralenBryantBanks RusBlackwell BeauBrasso
3903,LeeMarvin AngieDickinson KeenanWynn CarrollO'Connor
3904,AlessandroGassman FrancescoQuinn JoeUrla LennyVenito
3905,JakeHoffman NikkiReed ThomasDekker ScottBakula
3906,ShantelVanSanten JohnRobinson JamesPatrickStuart BrittanyMurphy
3907,LukeGoss RZA BokeemWoodbine LouisMandylor
3908,EverettMcGill FabioTesti MichaelMadsen JackTaylor
3909,FrankVincent KathrineNarducci MikeStarr StacyKeach
3910,PatrickWilson MalcolmMcDowell JudyGreer ChloëSevigny
3911,FernandaMontenegro MaríliaPêra ViníciusdeOliveira OthonBastos
3912,GlennFord BetteDavis HopeLange ArthurO'Connell
3913,ScottAdkins NickChinlund CaitlinKeats JakeLaBotz
3914,BrendaVaccaro DyanCannon JosephBologna 
3915,KateBosworth WesBentley ShashawneeHall RichardRiehle
3916,ZoeSloane JadeViggiano AmancayaAguilar KahiryBess
3917,CéciledeFrance Maïwenn PhilippeNahon FranckKhalfoun
3918,RyanKwanten MaeveDermody MarshallNapier HeatherMitchell
3919,JamesRemar SherilynFenn RonCarlson GrahamGreene
3920,TerrenceHoward AnthonyAnderson TarynManning TarajiP.Henson
3921,MarilynMonroe TonyCurtis JackLemmon GeorgeRaft
3922,KaneHodder LarParkLincoln SusanJenniferSullivan KevinSpirtas
3923,JudyGarland FrankMorgan RayBolger BertLahr
3924,GeneWilder PeterBoyle MartyFeldman MadelineKahn
3925,MichelleMorgan JoshuaClose ShawnRoberts AmyLalonde
3926,SanjayDutt ArshadWarsi DilipPrabhavalkar VidyaBalan
3927,PeterFonda PatriciaRichardson ChristineDunford TomWood
3928,KellyReno MickeyRooney TeriGarr ClarenceMuse
3929,   
3930,CasperChristensen FrankHvam AliKazim IbenHjejle
3931,JohnWayne ElizabethAllen LeeMarvin CesarRomero
3932,HenriGarcin IngeborgElzevier KhaldounElmecky MargoDames
3933,SpencerTracy IreneDunne VanJohnson WardBond
3934,CleavonLittle GeneWilder HarveyKorman SlimPickens
3935,KimberlyBeck ErichAnderson CoreyFeldman BarbaraHoward
3936,AgataTrzebuchowska AgataKulesza JoannaKulig DawidOgrodnik
3937,JamesWilby HughGrant RupertGraves DenholmElliott
3938,ArtieLange RalphMacchio AnthonyDeSando JimmyPalumbo
3939,JeffClark DarrickDoerner LairdHamilton DaveKalama
3940,KarraElejalde CandelaFernández BárbaraGoenaga NachoVigalondo
3941,JoshRandall NickSearcy BethBroderick SaschaRosemann
3942,JoeCross PhilRiverstone AmyBadberg MervCross
3943,MarlonWayans EssenceAtkins NickSwardson CedrictheEntertainer
3944,   
3945,TomEverettScott JohnathonSchaech TomHanks SteveZahn
3946,TomAtkins StaceyNelkin DanO'Herlihy MichaelCurrie
3947,RoddyMcDowall KimHunter BradfordDillman NatalieTrundy
3948,PaulNewman MelvynDouglas PatriciaNeal BrandonDeWilde
3949,KevinHart DavidTerrell DavidJasonPerez JustineHerron
3950,RiverPhoenix KeanuReeves JamesRusso WilliamRichert
3951,ZachBraff NataliePortman IanHolm PeterSarsgaard
3952,EthanHawke JulieDelpy AndreaEckert HannoPöschl
3953,PatrickHuard MichelCôté CatherineFlorent AlbertMillaire
3954,BillyCrudup DenisLeary JackBlack DennisHopper
3955,MichelleKrusiec JoanChen LynnChen AtoEssandoh
3956,TannishthaChatterjee SatishKaushik ChristopherSimpson NaeemaBegum
3957,FrankLangella LivTyler JamesMarsden SusanSarandon
3958,SarahPolley AmandaPlummer ScottSpeedman LeonorWatling
3959,MilesTeller ShaileneWoodley BrieLarson DayoOkeniyi
3960,BillMaher JoseLuisDeJesusMiranda AndrewNewberg SteveBurg
3961,JoshuaTickell BarbaraBoxer RichardBranson GeorgeW.Bush
3962,PetePostlethwaite GabrielMann EmilyHarrison DianaScarwid
3963,CarlySchroeder AdrianDunbar GeorgeHarris KatharineRoss
3964,RockyMayorAnderson MattAune TylerBarrick BruceBarton
3965,JesseMetcalfe AustinBasis LarryMiller MichaelChen
3966,FrankaPotente BennoFürmann AnnaLoos OliverWnuk
3967,LeonorVarela JacobVargas LuisFernandoPeña 
3968,RainnWilson EllenPage LivTyler KevinBacon
3969,AshleyScott A.J.Buckley RolandaWatts VanessaEvigan
3970,MattO'Leary JessicaCook LanceHenriksen CliftonCollinsJr
3971,NatashaLyonne ChloëSevigny MegTilly MarkWebber
3972,OssieDavis CharlesS.Dutton AndreBraugher RichardBelzer
3973,MarcBlucas JustineWaddell BillMoseley PriscillaBarnes
3974,LukeWilson MayaRudolph DaxShepard TerryCrews
3975,KevinLeslie SimonCotton PhilDunster DannyMidwinter
3976,ThomasTurgoose StephenGraham JoHartley AndrewShim
3977,BiancaBree SeanBrosnan SimonPhillips Jean-ClaudeVanDamme
3978,RedSkelton EstherWilliams BasilRathbone BillGoodwin
3979,AimeeGarcia AlBandiero JossaraJinaro GinaRodriguez
3980,BreckinMeyer PeterFacinelli EddieMills EthanEmbry
3981,HowardKeel KathrynGrayson AvaGardner JoeE.Brown
3982,MichaelClarkeDuncan MorganSimpson KieleSanchez TarynManning
3983,SusanSarandon GilBellows EllenBurstyn TopherGrace
3984,JonLovitz TimothyStack PhilHartman DeannaOliver
3985,DeemsTaylor WaltDisney JuliettaNovis LeopoldStokowski
3986,NicoleSmolen KimBaldwin ArianaStephens BrysonFunk
3987,DanaKimmell PaulKratka TracieSavage JeffreyRogers
3988,MelanieKinnaman JohnShepherd ShavarRoss RichardYoung
3989,LouiseFletcher HenryThomas SorenFulton A.J.Buckley
3990,MiraSorvino SeanAstin AlexaPenaVega CybillShepherd
3991,BrianAustinGreen MelissaKeller LindenAshby JoeManganiello
3992,GreerGarson GregoryPeck DonaldCrisp LionelBarrymore
3993,JessicaLowndes EthanPeck DiegoBoneta NateParker
3994,ChrisBisson SaeedJaffrey SallyBankes PeterAsh
3995,AllisonMiller JamesWolk KateySagal RumerWillis
3996,RobertEnglund TrevorMatthews DanielKash DavidFox
3997,FredricMarch MyrnaLoy DanaAndrews TeresaWright
3998,BradRenfro BijouPhillips NickStahl RachelMiner
3999,PerChristianEllefsen SvenNordin JørgenLanghelle MaritPiaJacobsen
4000,RobertFontaine MichaelBrainard GrantBoyd MichaelDerek
4001,MarthaHigareda ChadMichaelMurray YulVazquez BenitoMartinez
4002,   
4003,LouiseBrealey LeeRoss SheilaReid PippaNixon
4004,JamesRansone ElisaLasowski JoshPeck AttilaÁrpa
4005,SeanConnery DanielaBianchi PedroArmendáriz LotteLenya
4006,RonFazio JohnAltamura PhoebeLegere RickCollins
4007,WoodyAllen DianeKeaton JohnBeck MaryGregory
4008,MaikaMonroe KeirGilchrist DanielZovatto JakeWeary
4009,WoodyAllen JohnCarradine LouJacobi LouiseLasser
4010,GregoryPeck BrockPeters JamesAnderson MaryBadham
4011,MelGibson BruceSpence MichaelPreston MaxPhipps
4012,HilarySwank ChloëSevigny PeterSarsgaard BrendanSextonIII
4013,ElizabethOlsen AdamTrese EricShefferStevens JuliaTaylorRoss
4014,MartinaGedeck UlrichMühe SebastianKoch UlrichTukur
4015,AlexKendrick KenBevel BenDavies KevinDownes
4016,PaulNewman JackieGleason PiperLaurie GeorgeC.Scott
4017,ClarkGable SpencerTracy ClaudetteColbert HedyLamarr
4018,BéatriceBonifassi LinaBoudreau MichèleCaucheteux Jean-ClaudeDonda
4019,AdamBeach EvanAdams IreneBedard GaryFarmer
4020,PaulGiamatti HopeDavis JudahFriedlander JamesUrbaniak
4021,EthanHawke JulieDelpy VernonDobtcheff LouiseLemoineTorrès
4022,GaelGarcíaBernal VanessaBauche GoyaToledo AlvaroGuerrero
4023,EvanRachelWood NikkiReed VanessaHudgens HollyHunter
4024,GregoryPeck DorothyMcGuire JohnGarfield CelesteHolm
4025,JenniferLawrence JohnHawkes KevinBreznahan DaleDickey
4026,BrendanMackey NicholasAaron RichardHawking OllieRyall
4027,TyronePower AliceFaye DonAmeche EthelMerman
4028,MirandaJuly JohnHawkes BrandonRatcliff MilesThompson
4029,MattDamon WilliamAckman BarackObama GeorgeW.Bush
4030,ZacEfron EmilyRatajkowski WesBentley NickRotteveel
4031,ForestWhitaker CliffGorman TriciaVessey HenrySilva
4032,ChristianBale FreddyRodríguez EvaLongoria ChakaForman
4033,KateMara DavidOyelowo MichaelKennethWilliams MimiRogers
4034,DavidDuchovny NickyKatt CatherineKeener MaryMcCormack
4035,StephenNichols TawnyKitaen ToddAllen KathleenWilhoite
4036,Sook-YinLee PaulDawson PJDeBoy JayBrannan
4037,AriFolman RonBen-Yishai DrorHarazi RonnyDayag
4038,KirbyHeyborne MichaelFlynn  
4039,CampbellScott GeraldBurke AliFadhil RobertHutchings
4040,BelPowley KristenWiig AlexanderSkarsgård ChristopherMeloni
4041,BuzzAldrin MichaelCollins AlanBean EugeneCernan
4042,MichelleWilliams BruceGreenwood WillPatton ZoeKazan
4043,DennisHopper PeterBart WarrenBeatty CarlBernstein
4044,DannyAiello JohnRothman FrankBongiorno LexieSperduto
4045,ToniCollette ParkerPosey LisaKudrow AlannaUbach
4046,MattBennett ZackPearlman JacobDavich JustinKline
4047,IsabelleAdjani ChristopherLambert RichardBohringer MichelGalabru
4048,RobinWilliams DavidDuchovny AntonYelchin TéaLeoni
4049,JessWeixler JohnHensley JoshPais HaleAppleman
4050,JeffreyFalcon JustinMcGuire KimDeAngelo StephaneGauger
4051,   
4052,PaulKaye KateMagowan NeilMaskell BeatrizBatarda
4053,SteveBuscemi RomanyMalco TimBlakeNelson SarahSilverman
4054,BobHoskins DannyNussbaum BruceJones AnnetteBadland
4055,JeremyIrvine JonnyBeauchamp JonathanRhysMeyers RonPerlman
4056,SaifAliKhan KareenaKapoor JavedJaffrey TanaazCurrimIrani
4057,JamesCaan JamesCaan FrankVincent VincentPastore
4058,WilliamBrent SammiHanratty JamesHong AlexKendrick
4059,AnnaKendrick JeremyJordan NatalieKnepp BettinaBresnan
4060,MichaelShannon AmyRyan FrankWood LindaEmond
4061,MelindaClarke J.TrevorEdmond KentMcCord SarahDouglas
4062,ChrisEvans JessicaBiel JoyBryant JasonStatham
4063,MaggieGyllenhaal MichelleHurst SandraRodríguez DannyTrejo
4064,JulieBenz CarterJenkins CesarGarcia MercyMalick
4065,KellyReilly MichaelFassbender TaraEllis JackO'Connell
4066,EmilyBrowning XavierSamuel CamGigandet DawnOlivieri
4067,JamesCorden MathewHorne PaulMcGann MyAnnaBuring
4068,DanielBuckland RobertHobbs RapulanaSeiphemo JeffreyZekele
4069,LeeEvans SeanMcGinley IanMcNeice ColinSalmon
4070,SeanRogerson JuanRiedinger AshleighGryzko MackenzieGray
4071,RossNoble TommyKnight Gemma-LeahDevereux JohnMcDonnell
4072,MelissaJoanHart JohnTerry ChipBent LawrenceTurner
4073,TonyOppedisano   
4074,WoodyAllen LouiseLasser CarlosMontalbán NatiAbascal
4075,LinusRoache DerekTing RichardNg MichaelPark
4076,NicholasGonzalez MarioCimarro OlegTaktarov VitaliBaganov
4077,RitaHayworth OrsonWelles EverettSloane GlennAnders
4078,StephenMartines ValerieCruz MirceaMonroe DesmondAskew
4079,JakeGyllenhaal SelmaBlair JaredLeto JohnC.McGinley
4080,MattLucas JunoTemple JamesCaan DolphLundgren
4081,GlennHowerton SteveLittle BenSchwartz AdriannePalicki
4082,WillKeenan CreedBratton DeAnnaJoyBrooks ReggieBannister
4083,PaulRudd PaulGiamatti SallyHawkins PeterHermann
4084,LexBarker ChristopherLee KarinDor CarlLange
4085,AnnaPaquin RyanPhillippe LukeWilson PowersBoothe
4086,ZeroMostel PhilSilvers BusterKeaton MichaelCrawford
4087,MichaelMoore EddieVedder RobertEllisOrrall SteveEarle
4088,EricBalfour LouTaylorPucci HenryThomas JamesLafferty
4089,TimOgletree TroyOgletree DaveSheridan JoeyOglesby
4090,BellaHeathcote LucasTill HelenSlater PenelopeMitchell
4091,DolphLundgren JamesChalke SaraMalakulLane MichaelAaronMilligan
4092,CrispinGlover KeanuReeves IoneSkye DanielRoebuck
4093,JamesWoods NickNolte ClaireForlani DarylHannah
4094,MikeMizanin MelissaRoxburgh JoshBlacker MatthewMacCaull
4095,RyanReynolds JoséLuisGarcíaPérez RobertPaterson StephenTobolowsky
4096,CraigRoberts SallyHawkins PaddyConsidine NoahTaylor
4097,KhalidAbdalla DinaAbdullah DinaAmer MagdyAshour
4098,LizzieBrocheré ArthurDupont GuillaumeBaché PierrePerrier
4099,PhilippePetit JeanFrançoisHeckel Jean-LouisBlondeau AnnieAllix
4100,DominicPurcell PeterFeeney OwenBlack SiobhanMarshall
4101,KekePalmer CoryHardrict EricD.HillJr. QuincyBrown
4102,AshleyBell PatrickFabian IrisBahr LouisHerthum
4103,AaronTaylor-Johnson Anne-MarieDuff KristinScottThomas DavidThrelfall
4104,VivienLeigh MarlonBrando KimHunter KarlMalden
4105,PeterSellers GeorgeC.Scott SterlingHayden KeenanWynn
4106,GaelGarcíaBernal AnaClaudiaTalancón SanchoGracia AngélicaAragón
4107,QuvenzhanéWallis DwightHenry LevyEasterly GinaMontana
4108,RoddyMcDowall NatalieTrundy AustinStoker SevernDarden
