,cast
933,JeremyRenner GemmaArterton FamkeJanssen PihlaViitala
934,RichardGere DianeLane OlivierMartinez ErikPerSullivan
935,AlexPettyfer TimothyOlyphant TeresaPalmer DiannaAgron
936,GeorgeClooney MattDamon JeffreyWright ChrisCooper
937,JamesBadgeDale JohnKrasinski MaxMartini PabloSchreiber
938,DiegoLuna ChanningTatum ZoeSaldana ChristinaApplegate
939,HarrisonFord PaulBettany VirginiaMadsen CarlySchroeder
940,ClintEastwood GeneHackman EdHarris ScottGlenn
941,DemiMoore ViggoMortensen AnneBancroft JasonBeghe
942,MichaelDouglas SeanPenn DeborahKaraUnger JamesRebhorn
943,RadhaMitchell SeanBean LaurieHolden DeborahKaraUnger
944,KeanuReeves GeneHackman BrookeLangton OrlandoJones
945,JasonBiggs AlysonHannigan SeannWilliamScott ChrisKlein
946,SamuelL.Jackson KevinSpacey DavidMorse RonRifkin
947,RichardArmitage SarahWayneCallies MattWalsh NathanKress
948,EddieMurphy JudgeReinhold HéctorElizondo GilbertR.Hill
949,ZachGalligan PhoebeCates JohnGlover RobertProsky
950,RobertDuvall RobertDowneyJr. VeraFarmiga VincentD'Onofrio
951,GeorgeClooney NicoleKidman MarcelIureș GoranVisnjic
952,MillaJovovich SiennaGuillory OdedFehr ThomasKretschmann
953,RenéeZellweger HughGrant ColinFirth JimBroadbent
954,DenzelWashington EvaMendes SanaaLathan JohnBillingsley
955,StevenSeagal MichaelCaine JoanChen JohnC.McGinley
956,TaylorLautner TaylorDooley CaydenBoyd DavidArquette
957,LeonardoDiCaprio GuillaumeCanet TildaSwinton VirginieLedoyen
958,KateHudson JohnCorbett JoanCusack HaydenPanettiere
959,Rain NaomieHarris SungKang RandallDukKim
960,KevinCostner KellyPreston JohnC.Reilly JenaMalone
961,DemiMoore BurtReynolds ArmandAssante VingRhames
962,OwenWilson EmmaStone GeorgeLopez ChristopherMintz-Plasse
963,MattDamon BryceDallasHoward GeorgeMcLaren ThierryNeuvic
964,SandraBullock BenChaplin RyanGosling MichaelPitt
965,SylvesterStallone AntonioBanderas JulianneMoore AnatoliDavydov
966,GaspardUlliel AaranThomas GongLi DominicWest
967,BruceWillis MichellePfeiffer RobReiner ColleenRennison
968,SaoirseRonan DianeKruger JakeAbel WilliamHurt
969,JohnTravolta ConnieNielsen SamuelL.Jackson GiovanniRibisi
970,ClintEastwood JeffDaniels AnjelicaHuston WandaDeJesus
971,CliveOwen NaomiWatts ArminMueller-Stahl UlrichThomsen
972,KurtRussell StacyKeach SteveBuscemi PamGrier
973,EliMarienthal JenniferAniston VinDiesel ChristopherMcDonald
974,BillMurray AnjelicaHuston CateBlanchett WillemDafoe
975,MatthewMcConaughey GuguMbatha-Raw MahershalaAli KeriRussell
976,KevinSpacey KateWinslet LauraLinney GabrielMann
977,TommyLeeJones CedrictheEntertainer ChristinaMilian PaulaGarcés
978,LiamNeeson EdHarris JoelKinnaman BoydHolbrook
979,NaomiWatts ViggoMortensen VincentCassel ArminMueller-Stahl
980,PaulWalker JessicaAlba ScottCaan AshleyScott
981,MillaJovovich DustinHoffman FayeDunaway JohnMalkovich
982,DannyMcBride JamesFranco NataliePortman ZooeyDeschanel
983,DanielCraig NaomiWatts RachelWeisz MartonCsokas
984,JohnTravolta DustinHoffman MiaKirshner AlanAlda
985,JoeMantegna LaraFlynnBoyle JoePantoliano BrianHaley
986,DemiMoore GaryOldman RobertDuvall RobertProsky
987,NaomiWatts SeanPenn TyBurrell BrookeSmith
988,KeiraKnightley MickeyRourke EdgarRamírez DelroyLindo
989,DavidCaruso LindaFiorentino ChazzPalminteri MichaelBiehn
990,GerardButler MichaelC.Hall LoganLerman AmberValletta
991,AldenEhrenreich AliceEnglert JeremyIrons ViolaDavis
992,RobinWilliams CatherineKeener EdwardNorton DannyDeVito
993,BenStiller OwenWilson WillFerrell PenélopeCruz
994,OwenWilson MorganFreeman GarySinise SaraFoster
995,GarryShandling AnnetteBening JohnGoodman GregKinnear
996,NicolasCage AmberHeard WilliamFichtner BillyBurke
997,KristinKreuk ChrisKlein NealMcDonough MichaelClarkeDuncan
998,JetLi JasonStatham CarlaGugino DelroyLindo
999,AndrewDiceClay WayneNewton PriscillaPresley MorrisDay
1000,TomSturridge PhilipSeymourHoffman RhysIfans BillNighy
1001,MichaelDouglas BeniciodelToro JacobVargas TomásMilián
1002,HarrisonFord SeanConnery DenholmElliott AlisonDoody
1003,KeiraKnightley JudeLaw AaronTaylor-Johnson KellyMacdonald
1004,SharltoCopley DevPatel Ninja YolandiVisser
1005,DenzelWashington AngelinaJolie QueenLatifah MichaelRooker
1006,JodieFoster KristenStewart ForestWhitaker DwightYoakam
1007,LochlynMunro ChandraWest SteveBacic JiannaBallard
1008,GeorgeClooney MarkWahlberg IceCube SpikeJonze
1009,TomHardy GaryOldman NoomiRapace JoelKinnaman
1010,CubaGoodingJr. SethGreen WhoopiGoldberg BreckinMeyer
1011,JeffBridges KevinSpacey MaryMcCormack AlfreWoodard
1012,MegRyan HughJackman LievSchreiber BreckinMeyer
1013,ElizabethHurley BrendanFraser FrancesO'Connor OrlandoJones
1014,RichardGere GregoryHines DianeLane LonetteMcKee
1015,RussellCrowe ChristianBale LoganLerman DallasRoberts
1016,LiamNeeson ForestWhitaker MaggieGrace FamkeJanssen
1017,GeorgeClooney JenniferLopez VingRhames DonCheadle
1018,JimCarrey MatthewBroderick LeslieMann JackBlack
1019,AamirKhan NanditaDas MaiaSethna KituGidwani
1020,WarrenBeatty AlPacino Madonna CharlieKorsmo
1021,PierceBrosnan ReneRusso DenisLeary BenGazzara
1022,DrewBarrymore SteveZahn AdamGarcia BrittanyMurphy
1023,SylvesterStallone RichardCrenna BrianDennehy BillMcKinney
1024,DonatasBanionis NatalyaBondarchuk JüriJärvet AnatoliySolonitsyn
1025,GeorgeCarlin AndyDick SarahMichelleGellar LisaKaplan
1026,JuliaRoberts JohnMalkovich GeorgeCole MichaelGambon
1027,JuliaRoberts DermotMulroney CameronDiaz RupertEverett
1028,JuliaRoberts BillyCrystal CatherineZeta-Jones JohnCusack
1029,AlPacino RobinWilliams HilarySwank MauraTierney
1030,PatrickStewart JonathanFrakes BrentSpiner LeVarBurton
1031,JoshBrolin JohnMalkovich MeganFox MichaelFassbender
1032,DenzelWashington MegRyan LouDiamondPhillips MattDamon
1033,JimCarrey MauraTierney CaryElwes JenniferTilly
1034,BryanCranston DianeKruger JohnLeguizamo DanielMays
1035,LaurenceOlivier JacquelineBisset BenGazzara ToshirōMifune
1036,JohnGoodman ElizabethPerkins RickMoranis RosieO'Donnell
1037,LiamNeeson MaggieGrace FamkeJanssen RadeSerbedzija
1038,PamelaAnderson JennyMcCarthy MarnyEng CharlieSheen
1039,SandraBullock BenjaminBratt MichaelCaine CandiceBergen
1040,BrendanFraser JoshHutcherson AnitaBriem SethMeyers
1041,AnneHathaway JulieAndrews HéctorElizondo JohnRhys-Davies
1042,JuliaRoberts DenzelWashington SamShepard WilliamAtherton
1043,SusanSarandon TommyLeeJones Mary-LouiseParker AnthonyLaPaglia
1044,JackNicholson MorganFreeman SeanHayes BeverlyTodd
1045,HarrisonFord AnneArcher PatrickBergin ThoraBirch
1046,JenniferLopez JaneFonda MichaelVartan WandaSykes
1047,HughJackman JakeGyllenhaal PaulDano MariaBello
1048,DenzelWashington EthanHawke ScottGlenn TomBerenger
1049,TimAllen SigourneyWeaver AlanRickman TonyShalhoub
1050,AnnaFaris MarlonWayans JamesDeBello ShawnWayans
1051,AmyAdams JasonSegel EmilyBlunt JohnKrasinski
1052,WesleySnipes StephenDorff KrisKristofferson N'BusheWright
1053,SamuelL.Jackson RobBrown RobertRi'chard RickGonzalez
1054,BenAffleck SamuelL.Jackson KimStaunton ToniCollette
1055,JenniferLopez IceCube JonVoight EricStoltz
1056,PiperPerabo AdamGarcia JohnGoodman IzabellaMiko
1057,KeiraKnightley HeikeMakatsch EmmaThompson LauraLinney
1058,KevinSpacey JuliaLouis-Dreyfus HaydenPanettiere PhyllisDiller
1059,JohnnyDepp HeatherGraham IanHolm RobbieColtrane
1060,SylvesterStallone SharonStone JamesWoods RodSteiger
1061,KevinCostner DonJohnson CheechMarin GeorgePerez
1062,LucilleBall HenryFonda VanJohnson TomBosley
1063,WillFerrell RobertDuvall KateWalsh MusettaVander
1064,MartinFreeman ZooeyDeschanel SamRockwell YasiinBey
1065,KenanThompson ShedrackAndersonIII JermaineWilliams KeithRobinson
1066,MillaJovovich OdedFehr AliLarter IainGlen
1067,DrewBarrymore AdamSandler WendiMcLendon-Covey BellaThorne
1068,QueenLatifah LLCoolJ TimothyHutton GiancarloEsposito
1069,MerylStreep DavidStrathairn KevinBacon BenjaminBratt
1070,HalScardino Litefoot LindsayCrouse RichardJenkins
1071,BlakeLively TaylorKitsch AaronTaylor-Johnson BeniciodelToro
1072,ChrisEvans KimBasinger JasonStatham JessicaBiel
1073,RowanAtkinson JohnMalkovich NatalieImbruglia TashadeVasconcelos
1074,JuliaRoberts MerylStreep NicolasCage PaulGiamatti
1075,KyleMacLachlan FrancescaAnnis LeonardoCimino BradDourif
1076,EvanRachelWood JimSturgess JoeAnderson DanaFuchs
1077,LeonardoDiCaprio KateWinslet MichaelShannon KathrynHahn
1078,BruceWillis YasiinBey DavidMorse JennaStern
1079,VinDiesel MichelleYeoh MélanieThierry LambertWilson
1080,StevenSeagal KeenenIvoryWayans BobGunton BrianCox
1081,MichaelKeaton AndieMacDowell HarrisYulin EugeneLevy
1082,CarterJenkins AustinButler KevinNealon RobertHoffman
1083,JackNicholson AaronEckhart HelenMirren RobinWright
1084,MatthewBroderick UmaThurman WillFerrell EileenEssell
1085,BillyZane KristySwanson TreatWilliams CatherineZeta-Jones
1086,MattDamon HenryThomas PenélopeCruz SamShepard
1087,AnthonyHopkins JoanAllen PowersBoothe EdHarris
1088,EwanMcGregor PierceBrosnan JonBernthal KimCattrall
1089,TreatWilliams FamkeJanssen AnthonyHeald KevinJ.O'Connor
1090,DerekLuke MichaelEaly LazAlonso JohnTurturro
1091,NicolasCage ShahkritYamnarm CharlieYeung PanwardHemmanee
1092,TimAllen ReneRusso PatrickWarburton BenFoster
1093,JavierBardem UnaxUgalde BenjaminBratt CatalinaSandinoMoreno
1094,CharlieSheen DonaldSutherland LindaHamilton StephenLang
1095,RowanAtkinson DominicWest GillianAnderson RosamundPike
1096,CharlieSheen WayneBrady HilaryDuff EvaLongoria
1097,BenAffleck BryanCranston AlanArkin JohnGoodman
1098,HarrisonFord TommyLeeJones SelaWard JulianneMoore
1099,GerardButler JenniferAniston GioPerez SiobhanFallon
1100,RobertDeNiro BradPitt KevinBacon JasonPatric
1101,SylvesterStallone RichardCrenna CharlesNapier StevenBerkoff
1102,DemiMoore AlecBaldwin JosephGordon-Levitt AnneHeche
1103,MelBlanc DonBrodie WalterCatlett MarionDarlington
1104,KrisKristofferson ChristopherWalken JohnHurt IsabelleHuppert
1105,KateBeckinsale ScottSpeedman TonyCurran ShaneBrolly
1106,JamesMcAvoy DanielRadcliffe JessicaBrownFindlay AndrewScott
1107,SeanConnery RobBrown F.MurrayAbraham AnnaPaquin
1108,SandraBullock ViggoMortensen DominicWest ElizabethPerkins
1109,JetLi MorganFreeman BobHoskins VincentRegan
1110,CameronDiaz ChristinaApplegate ThomasJane SelmaBlair
1111,TomCruise JeanneTripplehorn GeneHackman HollyHunter
1112,ZacEfron AmandaCrew CharlieTahan AugustusPrew
1113,JasonStatham BenFoster DonaldSutherland MiniAnden
1114,ChanningTatum JonahHill BrieLarson DaveFranco
1115,JuliaRoberts HughGrant GinaMcKee TimMcInnerny
1116,MelGibson MirandaRichardson TimothySpall ImeldaStaunton
1117,BenStiller JenniferAniston PhilipSeymourHoffman DebraMessing
1118,EddieMurphy RobinGivens HalleBerry DavidAlanGrier
1119,SandraBullock MelissaMcCarthy DemiánBichir MichaelRapaport
1120,ElizabethTaylor RichardBurton RexHarrison RoddyMcDowall
1121,SalmaHayek KevinJames HenryWinkler JoeRogan
1122,AshleyJudd MorganFreeman JimCaviezel AmandaPeet
1123,BarbraStreisand JeffBridges LaurenBacall GeorgeSegal
1124,RichardGere LauraLinney WillPatton BobTracey
1125,SachaBaronCohen RichardBey RonPaul GustafHammarsten
1126,TimothyDalton CareyLowell RobertDavi TalisaSoto
1127,AmandaSeyfried GaryOldman BillyBurke ShilohFernandez
1128,RobertDeNiro CharlizeTheron EdwardBurns KelseyGrammer
1129,BobHoskins JohnLeguizamo DennisHopper SamanthaMathis
1130,NicolasCage BridgetMoynahan JaredLeto EthanHawke
1131,KatherineHeigl JasonO'Mara DanielSunjata JohnLeguizamo
1132,JamesFranco SethRogen LizzyCaplan RandallPark
1133,KateBosworth JangDong-gun GeoffreyRush DannyHuston
1134,DanyBoon DominiquePinon AndréDussollier Jean-PierreMarielle
1135,Eminem MekhiPhifer BrittanyMurphy KimBasinger
1136,JamelDebbouze AriéElmaleh MélissaTheuriau PatriceThibaud
1137,HeathLedger RufusSewell ShannynSossamon PaulBettany
1138,JackieChan LeeEvans ClaireForlani JulianSands
1139,BruceWillis ToniCollette OliviaWilliams HaleyJoelOsment
1140,SamWorthington ElizabethBanks JamieBell EdHarris
1141,OwenWilson SteveMartin JackBlack RashidaJones
1142,RalphMacchio PatMorita WilliamZabka MartinKove
1143,ChristianBale BradleyCooper AmyAdams JeremyRenner
1144,SandraBullock RyanReynolds MarySteenburgen CraigT.Nelson
1145,TommyLeeJones AshleyJudd BruceGreenwood AnnabethGish
1146,MichaelJ.Fox ChristopherLloyd LeaThompson ElisabethShue
1147,ScarlettJohansson MorganFreeman ChoiMin-sik AmrWaked
1148,DakotaJohnson JamieDornan JenniferEhle EloiseMumford
1149,AntonioBanderas CarlaGugino AlexaPenaVega DarylSabara
1150,MatthewMcConaughey SandraBullock SamuelL.Jackson KevinSpacey
1151,SteveMartin BonnieHunt PiperPerabo TomWelling
1152,MarkWahlberg TaylorKitsch EmileHirsch BenFoster
1153,TomHanks GeenaDavis Madonna LoriPetty
1154,PatrickWilson VeraFarmiga MadisonWolfe FrancesO'Connor
1155,JesseEisenberg AndrewGarfield JustinTimberlake ArmieHammer
1156,BenAffleck JenniferAniston DrewBarrymore JenniferConnelly
1157,AnnaFaris ReginaHall CraigBierko BillPullman
1158,DavidArquette NeveCampbell CourteneyCox PatrickDempsey
1159,MichaelJ.Fox ChristopherLloyd MarySteenburgen ThomasF.Wilson
1160,WillFerrell KevinHart AlisonBrie CraigT.Nelson
1161,GaryOldman WinonaRyder AnthonyHopkins KeanuReeves
1162,MerylStreep AmyAdams StanleyTucci ChrisMessina
1163,ChadwickBoseman T.R.Knight HarrisonFord NicoleBeharie
1164,MattDamon GwynethPaltrow JudeLaw CateBlanchett
1165,JimCarrey JeffDaniels RachelMelvin KathleenTurner
1166,PaulWalker BruceGreenwood MoonBloodgood JasonBiggs
1167,RobertDeNiro AnneHathaway ReneRusso AndersHolm
1168,KevinHart IceCube OliviaMunn TikaSumpter
1169,DanielDay-Lewis MadeleineStowe RussellMeans EricSchweig
1170,JamieFoxx KerryWashington ReginaKing HarryLennix
1171,JessicaAlba DevonAoki CliveOwen RosarioDawson
1172,DennisQuaid MatthewFox ForestWhitaker SigourneyWeaver
1173,PaulRudd JasonSegel RashidaJones AndySamberg
1174,GwynethPaltrow JackBlack JasonAlexander JoeViterelli
1175,KevinCostner TommyLeeJones GaryOldman KevinBacon
1176,MartinLawrence NiaLong EmilyProcter ZacharyLevi
1177,BradPitt JuliaRoberts JamesGandolfini J.K.Simmons
1178,ZacEfron LeslieMann MatthewPerry TylerSteelman
1179,CameronDiaz LeslieMann KateUpton DonJohnson
1180,BobbyCampo ShantelVanSanten NickZano HaleyWebb
1181,TomHanks MarkRylance AmyRyan AlanAlda
1182,OwenWilson GeneHackman GabrielMacht CharlesMalikWhitfield
1183,JonahHill RussellBrand RoseByrne ElisabethMoss
1184,RichardGere JenniferLopez SusanSarandon LisaAnnWalter
1185,GregorySmith KirstenDunst DenisLeary PhilHartman
1186,MichaelJaiWhite MartinSheen JohnLeguizamo TheresaRandle
1187,JimCaviezel GuyPearce RichardHarris JamesFrain
1188,MatthewMcConaughey MarisaTomei RyanPhillippe WilliamH.Macy
1189,LiamNeeson DianeKruger JanuaryJones AidanQuinn
1190,HughJackman ChristianBale MichaelCaine ScarlettJohansson
1191,JasonBateman JasonSudeikis CharlieDay JenniferAniston
1192,BrendanFraser RobCorddry RickyGervais JessicaAlba
1193,RudyYoungblood RaoulMaxTrujillo GerardoTaracena IazuaLarios
1194,TimothyDalton Maryamd'Abo JeroenKrabbé JoeDonBaker
1195,TopherGrace AliceBraga LaurenceFishburne AdrienBrody
1196,RobertRedford DebraWinger DarylHannah BrianDennehy
1197,JohnnyDepp JohnTurturro TimothyHutton CharlesS.Dutton
1198,KeanuReeves SandraBullock ShohrehAghdashloo ChristopherPlummer
1199,KateHudson GenaRowlands PeterSarsgaard JohnHurt
1200,JenniferGarner JoelEdgerton RonLivingston RosemarieDeWitt
1201,PatrickDempsey MichelleMonaghan KevinMcKidd ChrisMessina
1202,ChristopherWalken VincentPiazza FreyaTingley JamesMadio
1203,MattDamon DannyDeVito JonVoight ClaireDanes
1204,HalleBerry RobertDowneyJr. CharlesS.Dutton PenélopeCruz
1205,MorganFreeman NigelHawthorne AnthonyHopkins DjimonHounsou
1206,SeanConnery LorraineBracco JoséWilker RodolfoDeAlexandre
1207,StevenPasquale ReikoAylesworth JohnOrtiz ArielGade
1208,MacaulayCulkin JohnLarroquette EdwardHerrmann ChristineEbersole
1209,RichardGere WinonaRyder AnthonyLaPaglia ElaineStritch
1210,DrewBarrymore HughGrant ScottPorter BradGarrett
1211,SethRogen SimonPegg NickFrost JasonBateman
1212,SethRogen BarbraStreisand YvonneStrahovski ColinHanks
1213,DavidArquette NeveCampbell CourteneyCox EmmaRoberts
1214,NicolasCage JoaquinPhoenix JamesGandolfini ChrisBauer
1215,ValKilmer MegRyan KyleMacLachlan FrankWhaley
1216,CameronDiaz JasonSegel RobCorddry EllieKemper
1217,MegRyan DianeKeaton LisaKudrow WalterMatthau
1218,EmmaBell NicholasD'Agosto MilesFisher EllenWroe
1219,HughGrant JamesCaan JeanneTripplehorn BurtYoung
1220,KevinSpacey HelenHunt HaleyJoelOsment JayMohr
1221,DrewBarrymore JimmyFallon JasonSpevack JackKehler
1222,OwenWilson LeslieMann JoshPeck DavidDorfman
1223,SethMacFarlane CharlizeTheron LiamNeeson AmandaSeyfried
1224,AlecBaldwin JohnLone PenelopeAnnMiller PeterBoyle
1225,ThomasHorn TomHanks SandraBullock MaxvonSydow
1226,RachelMcAdams HarrisonFord PatrickWilson JeffGoldblum
1227,50Cent JoyBryant AdewaleAkinnuoye-Agbaje OmarBensonMiller
1228,WesleySnipes DonaldSutherland MauryChaykin AnneArcher
1229,AnthonyRapp AdamPascal RosarioDawson JesseL.Martin
1230,KimBasinger AngelaBettis HollistonColeman RufusSewell
1231,SteveMartin GoldieHawn JohnCleese MarkMcKinney
1232,MarlonBrando ValKilmer DavidThewlis FairuzaBalk
1233,CatherineDeneuve MenaSuvari StephenRea TimRoth
1234,NataliePortman ScarlettJohansson EricBana JimSturgess
1235,KeanuReeves CharlizeTheron JasonIsaacs GregGermann
1236,HilarySwank DavidMorrissey IdrisElba AnnaSophiaRobb
1237,HarveyKeitel RobertDeNiro DavidProval AmyRobinson
1238,DannyDeVito MarkWahlberg GregoryHines JamesRemar
1239,ZoeSaldana CliffCurtis CallumBlue MichaelVartan
1240,JessalynGilsig CaryElwes GaryOldman DonRickles
1241,RobertDeNiro JamesFranco FrancesMcDormand ElizaDushku
1242,ValKilmer MiraSorvino KellyMcGillis StevenWeber
1243,MartinHenderson IceCube MonetMazur AdamScott
1244,AlPacino JohnCusack BridgetFonda DannyAiello
1245,ElizabethBerkley KyleMacLachlan GinaGershon GlennPlummer
1246,KirstenDunst JasonSchwartzman JudyDavis RipTorn
1247,DavidCaruso SamuelL.Jackson NicolasCage HelenHunt
1248,SylvesterStallone MirandaRichardson RachaelLeighCook MickeyRourke
1249,NaomiWatts EwanMcGregor TomHolland SamuelJoslin
1250,WarrenBeatty DustinHoffman IsabelleAdjani CharlesGrodin
1251,GeorgeClooney MerylStreep JasonSchwartzman BillMurray
1252,AngelinaJolie EdwardBurns TonyShalhoub ChristianKane
1253,ChevyChase DarylHannah SamNeill MichaelMcKean
1254,AudreyTautou MathieuKassovitz Rufus JamelDebbouze
1255,AshleyOlsen Mary-KateOlsen EugeneLevy AndyRichter
1256,JudeLaw MarisaTomei OmarEpps JaneKrakowski
1257,DrewBarrymore JohnKrasinski KristenBell VinessaShaw
1258,MichellePfeiffer TreatWilliams WhoopiGoldberg JonathanJackson
1259,StephenDorff NataschaMcElhone StephenRea UdoKier
1260,JohnC.Reilly JoshHutcherson ChrisMassoglia PatrickFugit
1261,BenStiller DrewBarrymore EileenEssell AmberValletta
1262,SamuelL.Jackson BernieMac SharonLeal AdamHerschman
1263,M.EmmetWalsh RichardJordan DavidSelby AnneArcher
1264,Jean-ClaudeVanDamme KianaTom BillGoldberg MichaelJaiWhite
1265,BenFoster DennisQuaid CamGigandet AntjeTraue
1266,GarySinise MadeleineStowe MekhiPhifer VincentD'Onofrio
1267,DevonSawa BridgetteWilson RufusSewell RupertGraves
1268,JeanReno ChristinaApplegate ChristianClavier MattRoss
1269,CillianMurphy RoseByrne ChrisEvans MichelleYeoh
1270,EddieMurphy AllisonJanney CliffCurtis ClarkDuke
1271,FreddiePrinzeJr. JenniferLoveHewitt ValKilmer AnneBancroft
1272,SeanPenn JasmineTrinca JavierBardem RayWinstone
1273,AlexPettyfer SarahBolger EwanMcGregor RobbieColtrane
1274,ShiaLaBeouf SarahRoemer Carrie-AnneMoss DavidMorse
1275,JonnyLeeMiller AngelinaJolie JesseBradford MatthewLillard
1276,RichardGere TerrenceHoward JamesBrolin DianeKruger
1277,TimRobbins JenniferJasonLeigh PaulNewman CharlesDurning
1278,KunoBecker JayHernandez JasonScottLee DoskhanZholzhaksynov
1279,ChrisEvans SongKang-ho EdHarris JohnHurt
1280,VanessaParadis MathieuChedid GadElmaleh FrançoisCluzet
1281,MatthewBroderick AlecBaldwin ToniCollette CalistaFlockhart
1282,BrandonLee RochelleDavis ErnieHudson MichaelWincott
1283,Prabhas RanaDaggubati TamannaBhatia AnushkaShetty
1284,EricBana RachelMcAdams MichelleNolden ArlissHoward
1285,DianeKeaton MandyMoore GabrielMacht TomEverettScott
1286,CharlieTahan CatherineO'Hara MartinShort MartinLandau
1287,NathanFillion GinaTorres AlanTudyk MorenaBaccarin
1288,MegRyan TonyShalhoub JoeCortese KerryWashington
1289,ChristopherReeve RichardPryor JackieCooper MarcMcClure
1290,RobertDeNiro SylvesterStallone AlanArkin JonBernthal
1291,ChangChen HuJun TonyLeungChiu-Wai TakeshiKaneshiro
1292,ReeseWitherspoon JoshLucas PatrickDempsey CandiceBergen
1293,KatherineHeigl GerardButler EricWinter BreeTurner
1294,SteveMartin DanAykroyd PhilHartman GlenneHeadly
1295,AntonioBanderas CarlaGugino AlexaPenaVega DarylSabara
1296,PatrickStewart JonathanFrakes BrentSpiner LeVarBurton
1297,RobertPattinson ReeseWitherspoon ChristophWaltz TatumEtheridge
1298,Carrie-AnneMoss LucasGrabeel BlytheAuffarth CharlieSchlatter
1299,DenzelWashington VicellousReonShannon DeborahKaraUnger LievSchreiber
1300,JenniferLopez BillyCampbell JulietteLewis DanFutterman
1301,SigourneyWeaver JenniferLoveHewitt GeneHackman RayLiotta
1302,KevinJames RainiRodriguez EduardoVerástegui DaniellaAlonso
1303,JenniferLopez JimCaviezel JeremySisto TerrenceHoward
1304,TimAllen JulieBowen KellyLynch GregGermann
1305,JohnnyDepp FrankLangella LenaOlin EmmanuelleSeigner
1306,HughGrant GeneHackman SarahJessicaParker DavidMorse
1307,MarkWahlberg JenniferAniston JasonFlemyng DominicWest
1308,GaboureySidibe Mo'Nique PaulaPatton MariahCarey
1309,JeffBridges CarolineGoodall JohnSavage ScottWolf
1310,KurtRussell KeithDavid WilfordBrimley DonaldMoffat
1311,VinDiesel KarlUrban KateeSackhoff JordiMollà
1312,DennisQuaid DannyGlover R.LeeErmey ClaudiaStedelin
1313,JamesVanDerBeek RachaelLeighCook AshtonKutcher DylanMcDermott
1314,SaoirseRonan HarryTreadaway MaryKayPlace BillMurray
1315,JoaquinPhoenix PhilipSeymourHoffman AmyAdams LauraDern
1316,RyanCartwright HaydenChristensen MischaBarton JayVilliers
1317,RobBrown DennisQuaid DarrinHenson CharlesS.Dutton
1318,ChloëGraceMoretz NickRobinson AlexRoe MaikaMonroe
1319,MichaelB.Jordan SylvesterStallone GrahamMcTavish TessaThompson
1320,BenAffleck RebeccaHall JeremyRenner JonHamm
1321,CameronDiaz JenniferLopez ElizabethBanks AnnaKendrick
1322,GeorgeClooney FrancesMcDormand BradPitt JohnMalkovich
1323,AbigailBreslin JodieFoster GerardButler MichaelCarman
1324,DanielBrühl ChrisHemsworth OliviaWilde AlexandraMariaLara
1325,JulianneMoore WilliamH.Macy JohnC.Reilly TomCruise
1326,BruceWillis TracyMorgan JuanCarlosHernández SeannWilliamScott
1327,DakotaJohnson RebelWilson AlisonBrie NicholasBraun
1328,MorganFreeman AshleyJudd HarryConnickJr. NathanGamble
1329,KristenStewart RobertPattinson BillyBurke TaylorLautner
1330,DenzelWashington RobertDuvall AnneHeche KimberlyElise
1331,MartinLawrence LukeWilson DaveChappelle PeterGreene
1332,JasonSudeikis JenniferAniston WillPoulter EmmaRoberts
1333,VasilyStepanov PyotrFyodorov ЮлияСнигирь FyodorBondarchuk
1334,KurtRussell J.T.Walsh KathleenQuinlan M.C.Gainey
1335,SeanConnery KimBasinger KlausMariaBrandauer EdwardFox
1336,JohnCusack LizzyCaplan RobCorddry CraigRobinson
1337,MorganFreeman AshleyJudd NathanGamble CoziZuehlsdorff
1338,BenAffleck GarySinise CharlizeTheron DennisFarina
1339,VinDiesel LarenzTate TimothyOlyphant GenoSilva
1340,BradleyCooper EmmaStone RachelMcAdams BillMurray
1341,AlecBaldwin JamesWoods VirginiaMadsen WhoopiGoldberg
1342,EthanHawke YoukiKudoh ReeveCarney AnneSuzuki
1343,AnthonyHopkins ColinO'Donoghue AliceBraga TobyJones
1344,EthanHawke JudeLaw GoreVidal UmaThurman
1345,BetteMidler NathanLane StockardChanning DavidHydePierce
1346,AndySamberg CherylHines JeffDaniels PatrickWarburton
1347,ChrisRock BernieMac DylanBaker NickSearcy
1348,BradleyCooper EdHelms ZachGalifianakis JustinBartha
1349,MikeMyers HeatherGraham MichaelYork RobertWagner
1350,JackNicholson MichaelKeaton KimBasinger MichaelGough
1351,CharlieCox DougrayScott WesBentley RodrigoSantoro
1352,MelGibson DannyGlover JoePesci ReneRusso
1353,SandraBullock QuintonAaron KathyBates TimMcGraw
1354,AlexaPenaVega DarylSabara AntonioBanderas CarlaGugino
1355,JenniferAniston JasonBateman CharlieDay JasonSudeikis
1356,JeffBridges MattDamon JoshBrolin BarryPepper
1357,MerylStreep AnneHathaway EmilyBlunt StanleyTucci
1358,WilliamShatner LeonardNimoy DeForestKelley JamesDoohan
1359,JasonBateman MelissaMcCarthy JonFavreau AmandaPeet
1360,RobertDeNiro NickNolte JessicaLange JulietteLewis
1361,JimSturgess KevinSpacey KateBosworth AaronYoo
1362,AmySchumer BillHader BrieLarson ColinQuinn
1363,BernieMac AshtonKutcher ZoeSaldana JudithScott
1364,RalphFiennes JulietteBinoche WillemDafoe KristinScottThomas
1365,KevinSpacey GuyPearce DannyDeVito JamesCromwell
1366,MichaelAngarano KurtRussell KellyPreston DaniellePanabaker
1367,KevinKline JoanCusack TomSelleck MattDillon
1368,NatashaHenstridge BenKingsley MichaelMadsen AlfredMolina
1369,JohnSaxon RoneeBlakley HeatherLangenkamp AmandaWyss
1370,JenniferLopez VincentD'Onofrio VinceVaughn MarianneJean-Baptiste
1371,LeonardoDiCaprio JeremyIrons GérardDepardieu GabrielByrne
1372,DianeLane JohnMalkovich ScottGlenn DylanWalsh
1373,ChrisEvans SarahMichelleGellar Mako KevinSmith
1374,CubaGoodingJr. EdHarris AlfreWoodard S.EpathaMerkerson
1375,JustinTimberlake MilaKunis PatriciaClarkson WoodyHarrelson
1376,SethRogen RoseByrne ZacEfron ChloëGraceMoretz
1377,EmmaThompson TomHanks PaulGiamatti ColinFarrell
1378,DenzelWashington AngelaBassett AlbertHall AlFreeman
1379,PaulRudd LeslieMann JasonSegel MaudeApatow
1380,RobinWilliams JohnTravolta SethGreen JustinLong
1381,BillNighy MichaelSheen RhonaMitra ShaneBrolly
1382,RobinWilliams MandyMoore JohnKrasinski EricChristianOlsen
1383,JonHeder RobSchneider DavidSpade JonLovitz
1384,DianeLane JohnCusack ElizabethPerkins ChristopherPlummer
1385,JohnnyDepp AlPacino MichaelMadsen BrunoKirby
1386,MillaJovovich MichelleRodriguez EricMabius RyanMcCluskey
1387,CraigT.Nelson JoBethWilliams BeatriceStraight HeatherO'Rourke
1388,TomHanks IrmaP.Hall MarlonWayans J.K.Simmons
1389,MarkWahlberg MilaKunis BeauBridges Ludacris
1390,JustinTimberlake AmandaSeyfried CillianMurphy OliviaWilde
