,cast
2301,ArnoldSchwarzenegger CarlWeathers ElpidiaCarrillo BillDuke
2302,F.MurrayAbraham TomHulce ElizabethBerridge RoyDotrice
2303,BrittanySnow ScottPorter JessicaStroup DanaDavis
2304,LindsayLohan RachelMcAdams TimMeadows AnaGasteyer
2305,DianeLane SandraOh LindsayDuncan RaoulBova
2306,HelenMirren CliveOwen MaggieSmith GeraldineSomerville
2307,KathleenTurner NicolasCage BarryMiller CatherineHicks
2308,MichaelKeaton EmmaStone ZachGalifianakis NaomiWatts
2309,CateBlanchett AlecBaldwin SallyHawkins BobbyCannavale
2310,J.J.Johnson PollyAdams TrishGates NancyMcDoniel
2311,JessicaAlba MekhiPhifer JoyBryant RomeoMiller
2312,LeslieNielsen NicolletteSheridan CharlesDurning MarciaGayHarden
2313,AdrienneBarbeau JamieLeeCurtis JanetLeigh JohnHouseman
2314,AnnaSophiaRobb HelenHunt LorraineNicholson CarrieUnderwood
2315,AlanArkin MartinBalsam RichardBenjamin ArtGarfunkel
2316,SethRogen AnnaFaris MichaelPeña RayLiotta
2317,ArnoldSchwarzenegger GraceJones WiltChamberlain TraceyWalter
2318,RobertDeNiro JoePesci CathyMoriarty FrankVincent
2319,AaronEckhart JenniferAniston JudyGreer MartinSheen
2320,NicholasRowe AlanCox SophieWard AnthonyHiggins
2321,KayPanabaker NaturiNaughton KheringtonPayne MeganMullally
2322,JamesFranco KateMara AmberTamblyn ClémencePoésy
2323,WoodyAllen CarolynSaxon TraceyUllman MichaelRapaport
2324,AmandaSchull ZoeSaldana SusanMayPratt PeterGallagher
2325,SteveMartin DianeKeaton JohnGoodman AlanArkin
2326,KristenStewart CorbinBleu MaxThieriot JenniferBeals
2327,KevinKline KristinScottThomas HaydenChristensen JenaMalone
2328,MichaelFassbender KateWinslet SethRogen KatherineWaterston
2329,HaydenPanettiere PaulRust LaurenLondon LaurenStorm
2330,MichaelCera ZachGalifianakis JustinLong RayLiotta
2331,ChristopherLloyd MattClark JuaninClay JasonRobards
2332,PierceBrosnan GeoffreyRush JamieLeeCurtis LeonorVarela
2333,JohnTravolta NancyAllen JohnLithgow DennisFranz
2334,EthanHawke SelenaGomez JonVoight PaulFreeman
2335,KevinKline JoanAllen SigourneyWeaver HenryCzerny
2336,MichaelDouglas DianeKeaton SterlingJerins PalomaGuzmán
2337,ShelleyLong CraigT.Nelson BettyThomas MaryGross
2338,MichaelGambon AnnetteBening LeighLawson ShaunEvans
2339,MickeyRourke KimBasinger MargaretWhitton DavidMargulies
2340,PeterMacNicol CaitlinClarke RalphRichardson JohnHallam
2341,JamesMcAvoy ChristopherPlummer HelenMirren PaulGiamatti
2342,JohnnyDepp MartinLandau SarahJessicaParker PatriciaArquette
2343,JoshBrolin KateWinslet GattlinGriffith TobeyMaguire
2344,TadanobuAsano SunHonglei KhulanChuluun Aliya
2345,MarkStrong TomWilkinson TobyKebbell GerardButler
2346,BarryBostwick MichaelBeck PersisKhambatta HenrySilva
2347,KennethBranagh DerekJacobi JulieChristie RichardBriers
2348,ChiCao ChengwuGuo WenBinHuang JoanChen
2349,MichaelShannon JaedenLieberher JoelEdgerton KirstenDunst
2350,WoodyAllen JasonBiggs ChristinaRicci StockardChanning
2351,JeremyIrvine ColinFirth StellanSkarsgård MichaelMacKenzie
2352,UrsinaLardi UlrichTukur BurghartKlaußner ChristianFriedel
2353,EmilyRoyaO'Brien AdrianGaeta ZackWard SarahAnnSchultz
2354,CharlieSheen NickCassavetes SherilynFenn RandyQuaid
2355,ValKilmer VincentD'Onofrio AdamGoldberg LuisGuzmán
2356,DaneDeHaan MackenzieGray JamesHetfield LarsUlrich
2357,BillyBobThornton KimBasinger MickeyRourke WinonaRyder
2358,EdgarRamírez AlexanderScheer FadiAbiSamra NoravonWaldstätten
2359,JoshHartnett EliasKoteas TakuyaKimura LeeByung-hun
2360,TomBerenger JoaquimdeAlmeida DanielaRomo MarkMoses
2361,LoriCardille TerryAlexander JosephPilato JarlathConroy
2362,JohnTravolta ChristopherMeloni RebeccaDeMornay AmandaSchull
2363,DanielCraig CatherineMcCormack RomolaGarai JonathanPryce
2364,ArnoldSchwarzenegger BrigitteNielsen SandahlBergman PaulL.Smith
2365,SigourneyWeaver RobertDeNiro CillianMurphy ElizabethOlsen
2366,JonahHill MichaelCera ChristopherMintz-Plasse BillHader
2367,TylerPerry DerekLuke KeshiaKnightPulliam WhoopiGoldberg
2368,JasonMomoa LucasTill JohnPyper-Ferguson StephenMcHattie
2369,BrianaEvigan RobertHoffman WillKemp CassieVentura
2370,AnneHathaway GlennClose JimBelushi PatrickWarburton
2371,DonCheadle SophieOkonedo NickNolte FanaMokoena
2372,TimothyOlyphant DougrayScott OlgaKurylenko RobertKnepper
2373,ForestWhitaker AngelaBassett JenniferHudson TyreseGibson
2374,BruceWillis JasonPatric JohnCusack JessicaLowndes
2375,MattDillon JamesCaan NataschaMcElhone GérardDepardieu
2376,NicoleKidman ChristopherEccleston AlakinaMann JamesBentley
2377,SigourneyWeaver MichaelBiehn JamesRemar PaulReiser
2378,AudreyHepburn RexHarrison StanleyHolloway WilfridHyde-White
2379,JenniferLoveHewitt SarahMichelleGellar RyanPhillippe FreddiePrinzeJr.
2380,JakeJohnson DamonWayansJr. NinaDobrev RobRiggle
2381,PaulGiamatti ThomasHadenChurch VirginiaMadsen SandraOh
2382,ErikStolhanske JayChandrasekhar SteveLemme PaulSoter
2383,DonaldPleasence JamieLeeCurtis P.J.Soles NancyKyes
2384,MollyShannon LiamAiken MatthewBroderick DonaldFaison
2385,TerrenceHoward HaroldPerrineau MorrisChestnut SanaaLathan
2386,RyanReynolds RayLiotta JosephRuskin AlexRocco
2387,TobinBell CostasMandylor BetsyRussell CaryElwes
2388,JoshHartnett ShannynSossamon AdamTrese EmmanuelleVaugier
2389,WillFerrell ChrisKattan JenniferCoolidge MichaelClarkeDuncan
2390,AlexPettyfer VanessaHudgens Mary-KateOlsen LisaGayHamilton
2391,AaronStanford KathleenQuinlan VinessaShaw EmiliedeRavin
2392,DavidSpade MaryMcCormack CraigBierko ScottTerra
2393,KevinCostner RamiroRodriguez CarlosPratts JohnnyOrtiz
2394,ShadMoss BrandonT.Jackson NaturiNaughton LorettaDevine
2395,T.I. EvanRoss JackieLong LaurenLondon
2396,AnnaKendrick SkylarAstin BrittanySnow AnnaCamp
2397,FreddiePrinzeJr. JessicaBiel FredWard MatthewLillard
2398,BillPaxton BridgetFonda BillyBobThornton BrentBriscoe
2399,LauraRegan MarcBlucas EthanEmbry DagmaraDomińczyk
2400,LarrytheCableGuy IrisBahr TonyHale DavidKoechner
2401,KevinClash MandyPatinkin VanessaWilliams SoniaManzano
2402,RichardGere DonCheadle EthanHawke WesleySnipes
2403,CharltonHeston AvaGardner DavidNiven BurtKwouk
2404,JaneLevy ShilohFernandez LouTaylorPucci JessicaLucas
2405,NiaVardalos RichardDreyfuss AlexisGeorgoulis AlistairMcGowan
2406,HughGrant DennisQuaid MandyMoore WillemDafoe
2407,ChristopherReeve MargotKidder GeneHackman JackieCooper
2408,RutinaWesley DwainMurphy BoydBanks CléBennett
2409,PaulWalker CameronBright VeraFarmiga ChazzPalminteri
2410,JimCaviezel ClaireForlani JeremyNortham MalcolmMcDowell
2411,Madonna SeanPenn PaulFreeman RichardGriffiths
2412,EdwardNorton JessicaBiel PaulGiamatti RufusSewell
2413,TippiHedren MelanieGriffith JerryMarshall KyaloMativo
2414,CateBlanchett GerardMcSorley CiaránHinds BrendaFricker
2415,BeniciodelToro JoshHutcherson BradyCorbet ClaudiaTraisac
2416,DwayneJohnson SeannWilliamScott SarahMichelleGellar MandyMoore
2417,VincentLindon PatrickTimsit PhilippeNahon AmandaLear
2418,Jan-MichaelVincent GeorgePeppard DominiqueSanda PaulWinfield
2419,AshleyGreene SebastianStan TomFelton JuliannaGuill
2420,AnnaChlumsky MacaulayCulkin DanAykroyd JamieLeeCurtis
2421,NicoleKidman RobertDowneyJr. TyBurrell HarrisYulin
2422,CharlieSheen MichaelDouglas MartinSheen DarylHannah
2423,KateWinslet EmmaThompson HughGrant TomWilkinson
2424,AnneHathaway JamesMcAvoy JulieWalters JamesCromwell
2425,AmandaBynes SaraPaxton MattLong JeremyHoward
2426,JenniferConnelly BenKingsley RonEldard FrancesFisher
2427,RobinWilliams EthanHawke RobertSeanLeonard GaleHansen
2428,JimCarrey JeffDaniels LaurenHolly TeriGarr
2429,MegRyan BillyCrystal CarrieFisher BrunoKirby
2430,PaulNewman CharlotteRampling JackWarden JamesMason
2431,BreckinMeyer SeannWilliamScott AmySmart PauloCostanzo
2432,JamesVanDerBeek AmySmart JonVoight PaulWalker
2433,JeanDujardin BéréniceBejo JohnGoodman JamesCromwell
2434,OdetteAnnable GaryOldman MeaganGood CamGigandet
2435,BruceWillis EdwardNorton JaredGilman KaraHayward
2436,JordanaBrewster TaylorHandley DioraBaird MattBomer
2437,AdamGreaves-Neal SaraLazzaro VincentWalsh SeanBean
2438,DanaCarvey BrentSpiner JenniferEsposito HaroldGould
2439,IvanaBaquero MaribelVerdú SergiLópez DougJones
2440,MichaelClarkeDuncan DavidArquette LeslieBibb JoeViterelli
2441,TyreseGibson TarajiP.Henson OmarGooding VingRhames
2442,MinkaKelly LeightonMeester CamGigandet AlyMichalka
2443,DavidSpade BrittanyDaniel DennisMiller AdamBeach
2444,Jean-ClaudeVanDamme GeoffreyLewis AlonnaShaw CoryEverson
2445,SimonPegg NickFrost JimBroadbent PaddyConsidine
2446,ClorisLeachman IndiaEnnenga AnnetteBening EvaMendes
2447,ScarlettJohansson RebeccaHall JavierBardem PenélopeCruz
2448,JoakimNätterqvist SofiaHelin StellanSkarsgård MichaelNyqvist
2449,FreddiePrinzeJr. ClaireForlani JasonBiggs AmandaDetmer
2450,AlisonLohman MichellePfeiffer ColeHauser RobinWright
2451,MeganFox AmandaSeyfried JohnnySimmons AdamBrody
2452,DannyDeVito BetteMidler NeveCampbell JamieLeeCurtis
2453,WoodyAllen MiaFarrow JeffDaniels LarryDavid
2454,RobertPattinson EmiliedeRavin PierceBrosnan LenaOlin
2455,MandyMoore TrentFord AllisonJanney AlexandraHolden
2456,DanAykroyd KimBasinger JonLovitz AlysonHannigan
2457,TomHanks DenzelWashington JasonRobards MarySteenburgen
2458,CraigBierko ArminMueller-Stahl GretchenMol VincentD'Onofrio
2459,JaRule TimMeadows JeniferLewis JonathanSilverman
2460,SeanConnery NatalieWood KarlMalden BrianKeith
2461,GwynethPaltrow ScottSpeedman MariaBello PaulGiamatti
2462,WoodyAllen GeorgeHamilton TéaLeoni DebraMessing
2463,GiuseppeAndrews JamesDeBello EdwardFurlong SamHuntington
2464,ChristopherLambert RoxanneHart ClancyBrown SeanConnery
2465,HalleBerry BeniciodelToro DavidDuchovny AlisonLohman
2466,ShaquilleO'Neal AnnabethGish RichardRoundtree JuddNelson
2467,MarionCotillard JeremyRenner JoaquinPhoenix DagmaraDomińczyk
2468,RalphFiennes NatashaRichardson HiroyukiSanada LynnRedgrave
2469,JamesMcAvoy VincentCassel RosarioDawson MattCross
2470,TomArnold KevinHart MethodMan SnoopDogg
2471,KadMerad DanyBoon ZoéFélix LorenzoAusilia-Foret
2472,ViggoMortensen JasonIsaacs MarkStrong StevenMackintosh
2473,NathanielBrown PazdelaHuerta CyrilRoy MasatoTanno
2474,AliciaSilverstone KrystenRitter SigourneyWeaver RichardLewis
2475,RichardGere JoanAllen JasonAlexander Cary-HiroyukiTagawa
2476,OrlandoBloom ForestWhitaker ConradKemp IngeBeckmann
2477,HilarySwank TommyLeeJones GraceGummer MerylStreep
2478,MiguelA.Núñez Jr. VivicaA.Fox KevinPollak
2479,SimonAbkarian CharlesAznavour ChristopherPlummer ArsinéeKhanjian
2480,JimCaviezel JakeLloyd MaryMcCormack BruceDern
2481,RayLiotta LLCoolJ MekhiPhifer JoleneBlalock
2482,JeanReno RyokoHirosue MichelMuller CaroleBouquet
2483,NathanFillion DonThompson ElizabethBanks GreggHenry
2484,EddieMurphy JudgeReinhold JohnAshton RonnyCox
2485,MacaulayCulkin JoePesci DanielStern JohnHeard
2486,TomSelleck SteveGuttenberg TedDanson NancyTravis
2487,DustinHoffman JessicaLange TeriGarr DabneyColeman
2488,TomCruise KellyMcGillis ValKilmer AnthonyEdwards
2489,KevinSpacey AnnetteBening ThoraBirch WesBentley
2490,ColinFirth GeoffreyRush HelenaBonhamCarter GuyPearce
2491,ArnoldSchwarzenegger DannyDeVito KellyPreston ChloeWebb
2492,WilliamHurt MariaBello KristenStewart EddieRedmayne
2493,WhoopiGoldberg MargaretAvery DannyGlover AkosuaBusia
2494,BenedictCumberbatch KeiraKnightley MatthewGoode RoryKinnear
2495,GoldieHawn EileenBrennan ArmandAssante RobertWebber
2496,SissySpacek TommyLeeJones LevonHelm BeverlyD'Angelo
2497,ZacharyGordon RobertCapron RachaelHarris SteveZahn
2498,JessicaChastain NikolajCoster-Waldau MeganCharpentier IsabelleNélisse
2499,ChevyChase BeverlyD'Angelo ImogeneCoca RandyQuaid
2500,JohnnyKnoxville JacksonNicoll GeorginaCates SpikeJonze
2501,HelenMirren MichaelSheen JamesCromwell SylviaSyms
2502,GeenaDavis AlecBaldwin WinonaRyder MichaelKeaton
2503,TylerPerry JillScott JanetJackson MichaelJaiWhite
2504,WinonaRyder GabrielByrne TriniAlvarado SamanthaMathis
2505,DanielRadcliffe CiaránHinds SidneyJohnston AlisaKhazanova
2506,CamillaBelle KatieCassidy TommyFlanagan BrianGeraghty
2507,FrankieMuniz PaulGiamatti AmandaBynes AmandaDetmer
2508,RobertDeNiro JohnCazale JohnSavage ChristopherWalken
2509,DustinHoffman RobertDeNiro AnneHeche WoodyHarrelson
2510,HilaryDuff AdamLamberg HallieTodd RobertCarradine
2511,DwayneJohnson BarryPepper JonBernthal SusanSarandon
2512,AdamScott ToniCollette AllisonTolman DavidKoechner
2513,JordanaBrewster ElijahWood CleaDuVall LauraHarris
2514,AngelaBassett LaurenceFishburne VanessaBellCalloway Rae'VenLarrymoreKelly
2515,SylvesterStallone HarveyKeitel RayLiotta RobertDeNiro
2516,ChylerLeigh ChrisEvans JaimePressly EricChristianOlsen
2517,JakeGyllenhaal MichaelPeña NatalieMartinez AnnaKendrick
2518,JoshuaJackson PaulWalker HillHarper LeslieBibb
2519,EddieRedmayne FelicityJones CharlieCox EmilyWatson
2520,JamieKennedy TayeDiggs AnthonyAnderson ReginaHall
2521,NataliePortman AshleyJudd StockardChanning JoanCusack
2522,PeterO'Toole AlecGuinness AnthonyQuinn JackHawkins
2523,ScoutTaylor-Compton SheriMoonZombie TylerMane ChaseWrightVanek
2524,ReeseWitherspoon LauraDern ThomasSadoski KeeneMcRae
2525,GarretDillahunt MichaelBowen JoshuaCox RikiLindhome
2526,DebraMessing DermotMulroney AmyAdams JackDavenport
2527,JamieLeeCurtis BradLoree BustaRhymes BiancaKajlich
2528,CaryElwes RobinWright MandyPatinkin AndrétheGiant
2529,DenzelWashington NateParker ForestWhitaker DenzelWhitaker
2530,RyanGosling CareyMulligan BryanCranston AlbertBrooks
2531,LindsayLohan AdamGarcia GlenneHeadly AlisonPill
2532,JenniferAniston PaulRudd HaydenPanettiere AlanAlda
2533,ImogenPoots RobertCarlyle RoseByrne JeremyRenner
2534,JimCaviezel MichaelChiklis LauraDern ClancyBrown
2535,JeffDaniels AnnaSophiaRobb CicelyTyson EvaMarieSaint
2536,ChrisWarren Jr. KylaPratt SanaaLathan
2537,JohnCusack MinnieDriver DanAykroyd JoanCusack
2538,SandraBullock ThomasHadenChurch BradleyCooper KenJeong
2539,KimDirector JeffreyDonovan EricaLeerhsen TristineSkyler
2540,RobinTunney FairuzaBalk NeveCampbell RachelTrue
2541,JonathanRhysMeyers ScarlettJohansson EmilyMortimer BrianCox
2542,JoeyKing SelenaGomez JohnCorbett BridgetMoynahan
2543,AnthonyHopkins EmmaThompson JamesFox ChristopherReeve
2544,MarkWahlberg BurtReynolds JohnC.Reilly JulianneMoore
2545,Jean-ClaudeVanDamme RosannaArquette KieranCulkin TedLevine
2546,TimMcGraw MariaBello ArmieHammer AlisonLohman
2547,MichaelBaileySmith ArchieKao JayAcovone JeffKober
2548,JenniferMorrison MatthewDavis LorettaDevine HartBochner
2549,AlexisBledel WilliamHurt SissySpacek JonathanJackson
2550,JohnCena KellyCarlson RobertPatrick AbigailBianca
2551,JordanPeele Keegan-MichaelKey TiffanyHaddish MethodMan
2552,GwynethPaltrow GarrettHedlund TimMcGraw LeightonMeester
2553,JamesMarsden KatieHolmes NickStahl SteveRailsback
2554,RyanGosling BradleyCooper EvaMendes DaneDeHaan
2555,PierceBrosnan LukeBracey OlgaKurylenko BillSmitrovich
2556,EwanMcGregor AshleyJudd PatrickBergin k.d.lang
2557,JeremyRenner AnthonyMackie BrianGeraghty GuyPearce
2558,DavidKeith DrewBarrymore FreddieJones HeatherLocklear
2559,BradPitt ScootMcNairy BenMendelsohn JamesGandolfini
2560,PhilipSeymourHoffman RachelMcAdams RobinWright DanielBrühl
2561,TomGreen RipTorn MarisaCoughlan EddieKayeThomas
2562,PhilVischer MikeNawrocki CamClarke LauraGerow
2563,Bono TheEdge AdamClayton LarryMullenJr.
2564,ChristopherLambert BrucePayne AdrianPaul DonnieYen
2565,AndréBenjamin PaulaPatton TerrenceHoward FaizonLove
2566,AnneHathaway JimSturgess PatriciaClarkson KenStott
2567,EllenPage AliaShawkat KristenWiig DrewBarrymore
2568,BarryPepper AndyDavoli SethGreen VinDiesel
2569,EdwardBurns RachelWeisz MorrisChestnut DustinHoffman
2570,AlbertBrooks SharonStone AndieMacDowell JeffBridges
2571,KevinKline AshleyJudd JonathanPryce KevinMcNally
2572,WoodyAllen MarvinChatinover MaeQuestel MiaFarrow
2573,   
2574,RussellCrowe LucyLiu JamieChung RZA
2575,DrewBarrymore CatherineO'Hara LukeWilson JakeBusey
2576,LeeleeSobieski ChrisKlein JoshHartnett MichaelRooker
2577,JonathanPryce RobertDeNiro KatherineHelmond IanHolm
2578,HilaryDuff OliverJames DavidKeith JohnnyLewis
2579,JeffBridges JohnGoodman JulianneMoore SteveBuscemi
2580,SamuelL.Jackson ChristinaRicci JustinTimberlake S.EpathaMerkerson
2581,KurtRussell ScottSpeedman MichaelMichele BrendanGleeson
2582,AngelinaJolie DanFutterman IrrfanKhan ArchiePanjabi
2583,JodiLynO'Keefe ShaneWest MarlaSokoloff JamesFranco
2584,CubaGoodingJr. HoratioSanz RoselynSánchez VivicaA.Fox
2585,RupertEverett ColinFirth ReeseWitherspoon JudiDench
2586,CampbellScott JenniferJasonLeigh DavidDukes EstelleParsons
2587,LukeWilson LoganLerman BrieLarson TimBlakeNelson
2588,ColinFarrell BrendanGleeson RalphFiennes ClémencePoésy
2589,CraigRobinson KerryWashington DavidAlanGrier S.EpathaMerkerson
2590,RainnWilson JoshGad ChristinaApplegate EmmaStone
2591,AlexisBledel ZachGilford RodrigoSantoro JaneLynch
2592,MattDamon JohnKrasinski FrancesMcDormand RosemarieDeWitt
2593,LarryDavid EvanRachelWood AdamBrooks MichaelMcKean
2594,SusanWard LoriHeuring MatthewSettle NathanBexton
2595,TommyLeeJones BarryPepper DwightYoakam JanuaryJones
2596,RobinWilliams ArminMueller-Stahl HannahTaylor-Gordon ÉvaIgó
2597,RobertDowneyJr. ValKilmer MichelleMonaghan CorbinBernsen
2598,DevonSawa SethGreen JessicaAlba VivicaA.Fox
2599,NaomiWatts LauraHarring AnnMiller DanHedaya
2600,AgnesBruckner HughDancy KatjaRiemann OlivierMartinez
2601,GemmaJones AnthonyHopkins NaomiWatts JoshBrolin
2602,CareyMulligan AndrewGarfield KeiraKnightley DomhnallGleeson
2603,ChrisO'Donnell AlfredMolina MichaelKeaton RoryCochrane
2604,WoodyHarrelson EmilyMortimer KateMara EduardoNoriega
2605,DarylHannah PamelaReed JamesRemar ThomasG.Waites
2606,MelanieGriffith DavidMorse LucasBlack CathyMoriarty
2607,NaomiWatts TimRoth MichaelPitt BradyCorbet
2608,ThomasStroppel ArtieAhr AmberMarieBollinger ChristineHaeberman
2609,BobHoskins ElaineCassidy ArsinéeKhanjian PeterMcDonald
2610,BrigitteHelm AlfredAbel GustavFröhlich RudolfKlein-Rogge
2611,DavidBelle CyrilRaffaelli TonyD'Amario DanyVerissimo-Petit
2612,AndyGarcía ChristopherLloyd WilliamForsythe BillNunn
2613,JoaquinPhoenix EdHarris ScottGlenn AnnaPaquin
2614,VladimirGarin KonstantinLavronenko NataliyaVdovina VanyaDobronravov
2615,TonyJaa SarunyuWongkrachang SorapongChatree PrimorataDejudom
2616,MichaelFassbender OlgaKurylenko DavidMorrissey LiamCunningham
2617,DolphLundgren GinaBellman ConradDunn ChristopherHeyerdahl
2618,BradleyCooper VinnieJones BrookeShields LeslieBibb
2619,EliasKoteas TerrenceHoward JenniferHudson WendyCrewson
2620,ChanningTatum AlPacino JulietteBinoche KatieHolmes
2621,MattLeBlanc EddieIzzard JamesCosmo NicoletteKrebitz
2622,PenélopeCruz MartinFreeman GwynethPaltrow SimonPegg
2623,AnnaFriel KarelRoden HansMatheson VincentRegan
2624,JakeT.Austin LiamNeeson SteveBuscemi AnnaSophiaRobb
2625,AntonioBanderas BirgitteHjortSørensen DylanMcDermott RobertForster
2626,BrucePayne MarkDymond ClemencyBurton-Hill EllieChidzey
2627,RodrigodelaSerna SergioHernández ÀlexBrendemühl MaximilianDirr
2628,LinusRoache JohnHannah SamanthaMorton EmilyWoof
2629,BillMurray AndieMacDowell ChrisElliott StephenTobolowsky
2630,ChanningTatum MattBomer JoeManganiello KevinNash
2631,LeonardoDiCaprio ClaireDanes JohnLeguizamo HaroldPerrineau
2632,KristinScottThomas NielsArestrup FrédéricPierrot MichelDuchaussoy
2633,CubaGoodingJr. WilliamSadler SharonLeal DavidRasche
2634,ClintEastwood GeneHackman MorganFreeman RichardHarris
2635,BryceDallasHoward IsaachDeBankolé DannyGlover WillemDafoe
2636,DevPatel FreidaPinto AnilKapoor MiaDrakeInderbitzin
2637,MichaelDouglas GlennClose AnneArcher EllenHamiltonLatzen
2638,JuliaRoberts RichardGere RalphBellamy JasonAlexander
2639,PaulHogan LindaKozlowski JohnMeillon ErnieDingo
2640,MaríaValverde VincentD'Onofrio ThomasJane AntonYelchin
2641,TomCruise RaymondJ.Barry CarolineKava HollyMarieCombs
2642,LeonRobinson DougE.Doug RawleD.Lewis MalikYoba
2643,JensenAckles JaimeKing KerrSmith BetsyRue
2644,ColumbusShort MeaganGood Ne-Yo DarrinHenson
2645,RogerMoore BarbaraBach CurdJürgens RichardKiel
2646,AliciaWitt JaredLeto RebeccaGayheart MichaelRosenbaum
2647,TylerPerry PhyliciaRashād ThandieNewton BrianJ.White
2648,KlausMariaBrandauer EthanHawke SeymourCassel SusanHogan
2649,MollyShannon WillFerrell ElaineHendrix HarlandWilliams
2650,MerylStreep AnthonyStewartHead HarryLloyd JimBroadbent
2651,PhilVischer MikeNawrocki TimHodge LisaVischer
2652,JanetJackson TupacAmaruShakur ReginaKing JoeTorry
2653,IceCube MikeEpps TommyFlanagan CarmenChaplin
2654,EddieMurphy AngelaBassett AllenPayne KadeemHardison
2655,LindaBlair RichardBurton LouiseFletcher MaxvonSydow
2656,DonaldSutherland SissySpacek JamesD'Arcy MatthewMarsh
2657,AshtonKutcher TaraReid AndyRichter JeffreyTambor
2658,MillaJovovich TimothyOlyphant SteveZahn ChrisHemsworth
2659,ForestWhitaker AmericaFerrera CarlosMencia ReginaKing
2660,TomEverettScott Mark-PaulGosselaar PoppyMontgomery LochlynMunro
2661,Cher JudiDench JoanPlowright MaggieSmith
2662,RobertJohnBurke JoeMantegna LucindaJenney MichaelConstantine
2663,LizaMinnelli RobertDeNiro LionelStander BarryPrimus
2664,AlfreWoodard DelroyLindo DavidPatrickKelly ZeldaHarris
2665,ChrisRock KerryWashington GinaTorres SteveBuscemi
2666,KaneHodder LexaDoig ChuckCampbell LisaRyder
2667,AnthonyHopkins HeatherGraham AshtonKutcher MaryElizabethWinstead
2668,MonicaPotter FreddiePrinzeJr. ShalomHarlow IvanaMiličević
2669,VictoriaJustice JacksonNicoll ChelseaHandler JoshPence
2670,MathieuAmalric EmmanuelleSeigner Marie-JoséeCroze AnneConsigny
2671,KateWinslet PatrickWilson JenniferConnelly JackieEarleHaley
2672,JoshuaJackson JamesMarsden KateHudson LenaHeadey
2673,DianeLane ViggoMortensen LievSchreiber AnnaPaquin
2674,TimRobbins DerekLuke BonnieHenna MncedisiShabangu
2675,ElizaDushku MelissaSagemiller WesBentley CaseyAffleck
2676,NickNolte GretaScacchi ThandieNewton GwynethPaltrow
2677,JessicaBiel BenBarnes KristinScottThomas ColinFirth
2678,AnthonyQuinn JenniferO'Neill MichaelSarrazin ChristopherLee
2679,TimothySpall DorothyAtkinson MarionBailey PaulJesson
2680,AndréDussollier SabineAzéma EmmanuelleDevos MathieuAmalric
2681,UlrichTukur MathieuKassovitz UlrichMühe MichelDuchaussoy
2682,TimRobbins RachelMcAdams MichaelPeña KerryBishé
2683,AnnaPaquin MattDamon MarkRuffalo MatthewBroderick
2684,DioraBaird LeslieNielsen SteveHowey KenanThompson
2685,MadelineCarroll CallanMcAuliffe RebeccaDeMornay AnthonyEdwards
2686,HeathLedger JakeGyllenhaal RandyQuaid MichelleWilliams
2687,AliciaSilverstone StaceyDash BrittanyMurphy PaulRudd
2688,JulianneMoore DennisQuaid DennisHaysbert PatriciaClarkson
2689,RobCorddry CraigRobinson ClarkDuke AdamScott
2690,GeoffreyRush KateWinslet JoaquinPhoenix MichaelCaine
2691,ColinFarrell SamRockwell WoodyHarrelson ChristopherWalken
2692,SamuelL.Jackson ColmFeore AnnMagnuson AunjanueEllis
2693,BrunoGanz AlexandraMariaLara CorinnaHarfouch UlrichMatthes
2694,JavierBardem BelénRueda LolaDueñas JoanDalmau
2695,ScarlettJohansson KryštofHádek PaulBrannigan MichaelMoreland
2696,RobinWilliams ForestWhitaker TungThanhTran ChintaraSukapatana
2697,HarveyKeitel JasonMewes BlakeClark JonPolito
2698,JustinBieber MileyCyrus UsherRaymond JadenSmith
2699,NataliePortman MilaKunis VincentCassel BarbaraHershey
2700,AlPacino RobertDuvall DianeKeaton RobertDeNiro
2701,JuliaStiles SeanPatrickThomas KerryWashington FredroStarr
2702,RobertEnglund TuesdayKnight KenSagoes RodneyEastman
2703,JenniferGarner KylieRogers MartinHenderson BrightonSharbino
2704,AshtonKutcher SeannWilliamScott KristySwanson JenniferGarner
2705,EmilioEstevez KieferSutherland LouDiamondPhillips CharlieSheen
2706,BillMurray MelissaMcCarthy NaomiWatts JaedenLieberher
2707,KevinHart MichaelEaly ReginaHall JoyBryant
2708,HeathLedger JuliaStiles JosephGordon-Levitt LarisaOleynik
2709,DJQualls ElizaDushku ZooeyDeschanel LyleLovett
2710,EmilioEstevez SamuelL.Jackson JonLovitz TimCurry
2711,BlakeLively ÓscarJaenada AngeloJosueLozanoCorzo JoséManuelTrujilloSalas
2712,AshtonKutcher MeloraWalters AmySmart EldenHenson
2713,ChevyChase ChrisElliott JeanSmart IggyPop
2714,LorettaDevine DelroyLindo IdrisElba ReginaKing
2715,KathleenTurner ChristopherLloyd KimCattrall PeterMacNicol
2716,MarkWahlberg LouDiamondPhillips ChristinaApplegate ChinaChow
2717,MichelleTrachtenberg RosieO'Donnell J.Smith-Cameron EarthaKitt
2718,AlexVincent JennyAgutter GerritGraham ChristineElise
2719,IdrisElba TarajiP.Henson LeslieBibb KatedelCastillo
2720,ThomasJane MarciaGayHarden LaurieHolden AndreBraugher
2721,DomhnallGleeson AliciaVikander OscarIsaac SonoyaMizuno
2722,JohnCusack CameronDiaz CatherineKeener CharlieSheen
2723,VivicaA.Fox MorrisChestnut AnthonyAnderson GabrielleUnion
2724,TeoHalm Astro ResseHartwig EllaWahlestedt
2725,KirstenDunst JayHernandez BruceDavison HermanOsorio
2726,KenWatanabe KazunariNinomiya TsuyoshiIhara RyoKase
2727,BillyBobThornton VirginiaMadsen MaxThieriot JasperPolish
2728,JadaPinkettSmith TommyDavidson DuaneMartin MichaelRalph
2729,BrieLarson JacobTremblay JoanAllen SeanBridgers
2730,NormMacdonald ArtieLange JackWarden TraylorHoward
2731,KathleenTurner SamWaterston RickiLake MatthewLillard
2732,KirstenDunst MichelleWilliams WillFerrell DanHedaya
2733,UsherRaymond VanessaWilliams ForestWhitaker RosarioDawson
2734,RyanPhillippe SalmaHayek BreckinMeyer MikeMyers
2735,JakeGyllenhaal SwoosieKurtz MarleyShelton DannyTrejo
2736,NicoleKidman BenChaplin VincentCassel MathieuKassovitz
2737,MilesTeller SkylarAstin JustinChon SarahWright
2738,SteveBuscemi NataliePortman WillemDafoe MaggieGyllenhaal
2739,SamuelL.Jackson JoshHartnett AlanAlda TeriHatcher
2740,TinaFey PaulRudd MichaelSheen LilyTomlin
2741,DanielAuteuil EmirKusturica JulietteBinoche MichelDuchaussoy
2742,JulianneMoore LiamNeeson AmandaSeyfried MaxThieriot
2743,Cher ChazzPalminteri RyanO'Neal PaulMazursky
2744,VinDiesel AlexRocco FrankPietrangolare RichardDeDomenico
2745,LoganLerman EmmaWatson EzraMiller PaulRudd
2746,ThomasIanGriffith LanceHenriksen JamesEarlJones BurtYoung
2747,SigourneyWeaver TobyJones GwynethPaltrow SandraBullock
2748,PeterMullan MillaJovovich WesBentley NastassjaKinski
2749,OliviaTaylorDudley MichaelPeña DjimonHounsou DougrayScott
