,cast
0,SamWorthington ZoeSaldana SigourneyWeaver StephenLang
1,JohnnyDepp OrlandoBloom KeiraKnightley StellanSkarsgård
2,DanielCraig ChristophWaltz LéaSeydoux RalphFiennes
3,ChristianBale MichaelCaine GaryOldman AnneHathaway
4,TaylorKitsch LynnCollins SamanthaMorton WillemDafoe
5,TobeyMaguire KirstenDunst JamesFranco ThomasHadenChurch
6,ZacharyLevi MandyMoore DonnaMurphy RonPerlman
7,RobertDowneyJr. ChrisHemsworth MarkRuffalo ChrisEvans
8,DanielRadcliffe RupertGrint EmmaWatson TomFelton
9,BenAffleck HenryCavill GalGadot AmyAdams
10,BrandonRouth KevinSpacey KateBosworth JamesMarsden
11,DanielCraig OlgaKurylenko MathieuAmalric JudiDench
12,JohnnyDepp OrlandoBloom KeiraKnightley StellanSkarsgård
13,JohnnyDepp ArmieHammer WilliamFichtner HelenaBonhamCarter
14,HenryCavill AmyAdams MichaelShannon KevinCostner
15,BenBarnes WilliamMoseley AnnaPopplewell SkandarKeynes
16,RobertDowneyJr. ChrisEvans MarkRuffalo ChrisHemsworth
17,JohnnyDepp PenélopeCruz IanMcShane KevinMcNally
18,WillSmith TommyLeeJones JoshBrolin MichaelStuhlbarg
19,MartinFreeman IanMcKellen RichardArmitage KenStott
20,AndrewGarfield EmmaStone RhysIfans DenisLeary
21,RussellCrowe CateBlanchett MaxvonSydow WilliamHurt
22,MartinFreeman IanMcKellen RichardArmitage KenStott
23,DakotaBlueRichards NicoleKidman DanielCraig SamElliott
24,NaomiWatts JackBlack AdrienBrody ThomasKretschmann
25,KateWinslet LeonardoDiCaprio FrancesFisher BillyZane
26,ChrisEvans RobertDowneyJr. ScarlettJohansson SebastianStan
27,TaylorKitsch AlexanderSkarsgård Rihanna BrooklynDecker
28,ChrisPratt BryceDallasHoward IrrfanKhan VincentD'Onofrio
29,DanielCraig JudiDench JavierBardem RalphFiennes
30,TobeyMaguire KirstenDunst JamesFranco AlfredMolina
31,RobertDowneyJr. GwynethPaltrow DonCheadle GuyPearce
32,MiaWasikowska JohnnyDepp AnneHathaway HelenaBonhamCarter
33,HughJackman HalleBerry IanMcKellen PatrickStewart
34,BillyCrystal JohnGoodman SteveBuscemi HelenMirren
35,ShiaLaBeouf MeganFox JoshDuhamel RainnWilson
36,MarkWahlberg StanleyTucci KelseyGrammer NicolaPeltz
37,JamesFranco MilaKunis RachelWeisz MichelleWilliams
38,AndrewGarfield EmmaStone JamieFoxx DaneDeHaan
39,GarrettHedlund JeffBridges OliviaWilde BruceBoxleitner
40,OwenWilson LarrytheCableGuy MichaelCaine EmilyMortimer
41,RyanReynolds BlakeLively PeterSarsgaard TimRobbins
42,TomHanks TimAllen NedBeatty JoanCusack
43,ChristianBale SamWorthington AntonYelchin MoonBloodgood
44,VinDiesel PaulWalker DwayneJohnson MichelleRodriguez
45,BradPitt MireilleEnos AbigailHargrove SterlingJerins
46,HughJackman JamesMcAvoy MichaelFassbender JenniferLawrence
47,ChrisPine ZacharyQuinto ZoeSaldana KarlUrban
48,NicholasHoult EleanorTomlinson EwanMcGregor StanleyTucci
49,LeonardoDiCaprio TobeyMaguire CareyMulligan JoelEdgerton
50,JakeGyllenhaal GemmaArterton BenKingsley AlfredMolina
51,IdrisElba CharlieHunnam CharlieDay RonPerlman
52,ShiaLaBeouf JohnMalkovich KenJeong FrancesMcDormand
53,HarrisonFord CateBlanchett ShiaLaBeouf RayWinstone
54,RaymondOchoa JackBright JeffreyWright FrancesMcDormand
55,KellyMacdonald JulieWalters BillyConnolly EmmaThompson
56,ChrisPine ZacharyQuinto KarlUrban SimonPegg
57,BenBurtt ElissaKnight JeffGarlin FredWillard
58,ChrisTucker JackieChan HiroyukiSanada MaxvonSydow
59,JohnCusack AmandaPeet ChiwetelEjiofor ThandieNewton
60,GaryOldman JimCarrey SteveValentine DarylSabara
61,MilaKunis ChanningTatum SeanBean EddieRedmayne
62,AlexanderSkarsgård MargotRobbie ChristophWaltz SamuelL.Jackson
63,WilliamMoseley AnnaPopplewell SkandarKeynes GeorgieHenley
64,JamesMcAvoy MichaelFassbender JenniferLawrence NicholasHoult
65,ChristianBale HeathLedger AaronEckhart MichaelCaine
66,EdAsner ChristopherPlummer JordanNagai BobPeterson
67,SethRogen ReeseWitherspoon HughLaurie PaulRudd
68,RobertDowneyJr. TerrenceHoward JeffBridges ShaunToub
69,BenKingsley SachaBaronCohen AsaButterfield ChloëGraceMoretz
70,WillSmith KevinKline KennethBranagh SalmaHayek
71,BrendanFraser JetLi JohnHannah MariaBello
72,WillSmith MargotRobbie JoelKinnaman ViolaDavis
73,SteveCarell LaurenGraham JohnGoodman JimmyBennett
74,TomCruise EmilyBlunt BrendanGleeson BillPaxton
75,KevinCostner ChaimGirafi RickAviles R.D.Call
76,DennisQuaid ChanningTatum MarlonWayans SiennaMiller
77,AmyPoehler PhyllisSmith RichardKind BillHader
78,NeelSethi BillMurray BenKingsley IdrisElba
79,RobertDowneyJr. GwynethPaltrow DonCheadle ScarlettJohansson
80,KristenStewart CharlizeTheron ChrisHemsworth SamClaflin
81,AngelinaJolie ElleFanning SharltoCopley SamRiley
82,AndySerkis JasonClarke GaryOldman KeriRussell
83,JoshHartnett SimoneKessell TamsinEgerton AliceEnglert
84,KeanuReeves HiroyukiSanada KouShibasaki TadanobuAsano
85,ChrisEvans SamuelL.Jackson ScarlettJohansson RobertRedford
86,MikeMyers EddieMurphy CameronDiaz AntonioBanderas
87,BrittRobertson GeorgeClooney RaffeyCassidy ThomasRobinson
88,ScottAdsit RyanPotter DanielHenney T.J.Miller
89,JohnC.Reilly SarahSilverman JackMcBrayer JaneLynch
90,TomHanks MichaelJeter NonaGaye PeterScolari
91,LiamHemsworth JeffGoldblum BillPullman MaikaMonroe
92,JayBaruchel GerardButler CraigFerguson AmericaFerrera
93,ArnoldSchwarzenegger NickStahl ClaireDanes KristannaLoken
94,ChrisPratt ZoeSaldana DaveBautista VinDiesel
95,MatthewMcConaughey JessicaChastain AnneHathaway MichaelCaine
96,LeonardoDiCaprio JosephGordon-Levitt EllenPage TomHardy
97,IanMcKellen MartinFreeman RichardArmitage AndySerkis
98,PaulWalker VinDiesel MichelleRodriguez JordanaBrewster
99,CateBlanchett BradPitt TildaSwinton JuliaOrmond
100,JamesMcAvoy MichaelFassbender JenniferLawrence KevinBacon
101,JenniferLawrence JoshHutcherson LiamHemsworth WoodyHarrelson
102,NicolasCage JayBaruchel MonicaBellucci AlfredMolina
103,KurtRussell RichardDreyfuss JoshLucas JacindaBarrett
104,JohnnyDepp MiaWasikowska AnneHathaway HelenaBonhamCarter
105,MikeMyers EddieMurphy CameronDiaz JulieAndrews
106,PaulaPatton TravisFimmel BenFoster RobertKazinsky
107,ArnoldSchwarzenegger JasonClarke EmiliaClarke JaiCourtney
108,SkandarKeynes GeorgieHenley SimonPegg GarySweet
109,BenAffleck JoshHartnett KateBeckinsale CubaGoodingJr.
110,ShiaLaBeouf JoshDuhamel MeganFox RachaelTaylor
111,ColinFarrell AngelinaJolie ValKilmer JaredLeto
112,DanielRadcliffe RupertGrint EmmaWatson MichaelGambon
113,DanielRadcliffe RupertGrint EmmaWatson RalphFiennes
114,WillSmith CharlizeTheron JasonBateman JaeHead
115,WillSmith AliceBraga CharlieTahan SalliRichardson-Whitfield
116,JohnnyDepp FreddieHighmore DavidKelly AnnaSophiaRobb
117,PattonOswalt IanHolm LouRomano BrianDennehy
118,ChristianBale MichaelCaine LiamNeeson KatieHolmes
119,BenStiller JadaPinkettSmith DavidSchwimmer ChrisRock
120,BenStiller AmyAdams OwenWilson HankAzaria
121,HughJackman LievSchreiber DannyHuston LynnCollins
122,KeanuReeves LaurenceFishburne Carrie-AnneMoss HugoWeaving
123,KristenBell IdinaMenzel JonathanGroff JoshGad
124,KeanuReeves Carrie-AnneMoss LaurenceFishburne HugoWeaving
125,ChrisHemsworth NataliePortman TomHiddleston AnthonyHopkins
126,TomHardy CharlizeTheron NicholasHoult HughKeays-Byrne
127,TomHanks EwanMcGregor AyeletZurer StellanSkarsgård
128,ChrisHemsworth NataliePortman TomHiddleston AnthonyHopkins
129,JohnTravolta MileyCyrus SusieEssman MarkWalton
130,SamRockwell PenélopeCruz TracyMorgan JonFavreau
131,SamWorthington LiamNeeson RalphFiennes EdgarRamírez
132,JohnnyDepp MichellePfeiffer HelenaBonhamCarter JackieEarleHaley
133,TomCruise RebeccaFerguson SimonPegg JeremyRenner
134,BeniciodelToro AnthonyHopkins EmilyBlunt HugoWeaving
135,JerrySeinfeld RenéeZellweger JimCummings MatthewBroderick
136,JackBlack AngelinaJolie DustinHoffman GaryOldman
137,NoahRinger NicolaPeltz JacksonRathbone DevPatel
138,TomCruise PhilipSeymourHoffman VingRhames BillyCrudup
139,ChanningTatum JamieFoxx JoeyKing MaggieGyllenhaal
140,SethGreen JoanCusack DanFogler BreckinMeyer
141,HughJackman KateWinslet IanMcKellen JeanReno
142,LeviMiller GarrettHedlund HughJackman RooneyMara
143,TyBurrell MaxCharles ArielWinter AllisonJanney
144,BradPitt OrlandoBloom EricBana BrianCox
145,BenStiller SachaBaronCohen DavidSchwimmer FrancesMcDormand
146,PierceBrosnan HalleBerry RosamundPike RickYune
147,MelissaMcCarthy KristenWiig KateMcKinnon LeslieJones
148,BruceWillis BillyBobThornton BenAffleck LivTyler
149,TommyLeeJones WillSmith RipTorn LaraFlynnBoyle
150,RayWinstone AngelinaJolie AnthonyHopkins RobinWright
151,JackBlack BryanCranston DustinHoffman AngelinaJolie
152,TomCruise JeremyRenner SimonPegg PaulaPatton
153,ChrisPine AlecBaldwin JudeLaw IslaFisher
154,JimCarrey TéaLeoni AlecBaldwin RichardJenkins
155,TomCruise KenWatanabe WilliamAtherton ChadLindberg
156,ChristianBale JoelEdgerton JohnTurturro AaronPaul
157,ChrisPine ZacharyQuinto LeonardNimoy EricBana
158,TobeyMaguire WillemDafoe KirstenDunst JamesFranco
159,JayBaruchel GerardButler KristenWiig JonahHill
160,BrentonThwaites NikolajCoster-Waldau GerardButler CourtneyEaton
161,JoshLucas JessicaBiel JamieFoxx SamShepard
162,MalinÅkerman BillyCrudup CarlaGugino JeffreyDeanMorgan
163,MelGibson DannyGlover JoePesci ReneRusso
164,EricBana JenniferConnelly SamElliott JoshLucas
165,DwayneJohnson D.J.Cotrona AdriannePalicki BruceWillis
166,MatthewMcConaughey PenélopeCruz SteveZahn WilliamH.Macy
167,DonaldSutherland Ming-NaWen AlecBaldwin VingRhames
168,ChrisEvans HugoWeaving TommyLeeJones HayleyAtwell
169,PierceBrosnan SophieMarceau RobertCarlyle DeniseRichards
170,RussellCrowe PaulBettany JamesD'Arcy BillyBoyd
171,KristenStewart RobertPattinson TaylorLautner PeterFacinelli
172,ElijahWood RobinWilliams Pink E.G.Daily
173,EdwardNorton LivTyler TimRoth WilliamHurt
174,RubyBarnhill MarkRylance RebeccaHall JemaineClement
175,LeonardoDiCaprio TomHardy WillPoulter DomhnallGleeson
176,RyanReynolds PaulGiamatti MichaelPeña SamuelL.Jackson
177,JohnnyDepp IslaFisher NedBeatty BillNighy
178,TomMcGrath ChrisMiller ChristopherKnights ConradVernon
179,MattDamon JuliaStiles DavidStrathairn ScottGlenn
180,JackBlack DustinHoffman AngelinaJolie JackieChan
181,PaulRudd MichaelDouglas EvangelineLilly CoreyStoll
182,JenniferLawrence JoshHutcherson LiamHemsworth WoodyHarrelson
183,JimParsons Rihanna SteveMartin JenniferLopez
184,TomCruise DakotaFanning MirandaOtto JustinChatwin
185,MartinLawrence WillSmith JordiMollà GabrielleUnion
186,AntonioBanderas SalmaHayek ZachGalifianakis BillyBobThornton
187,AngelinaJolie LievSchreiber ChiwetelEjiofor DanielOlbrychski
188,RussellCrowe JenniferConnelly EmmaWatson LoganLerman
189,JamieBell AndySerkis DanielCraig NickFrost
190,DanielRadcliffe RupertGrint EmmaWatson GaryOldman
191,NicoleKidman HughJackman EssieDavis DavidWenham
192,JadenSmith WillSmith SophieOkonedo ZoëKravitz
193,D.B.Sweeney AlfreWoodard OssieDavis MaxCasella
194,BenStiller RamiMalek RebelWilson RobinWilliams
195,WillFerrell BradPitt TinaFey JonahHill
196,DanielRadcliffe RupertGrint EmmaWatson RichardHarris
197,JeffBridges RyanReynolds KevinBacon StephanieSzostak
198,JohnnyDepp GeoffreyRush OrlandoBloom KeiraKnightley
199,JenniferLawrence JoshHutcherson LiamHemsworth WoodyHarrelson
200,TomHanks AudreyTautou IanMcKellen PaulBettany
201,JesseEisenberg AnneHathaway LeslieMann JamieFoxx
202,PatrickStewart HughJackman IanMcKellen HalleBerry
203,VinDiesel PaulWalker JordanaBrewster TyreseGibson
204,RobertDowneyJr. JudeLaw JaredHarris NoomiRapace
205,SamWorthington LiamNeeson RalphFiennes GemmaArterton
206,ArnoldSchwarzenegger SharonStone RachelTicotin RonnyCox
207,AntonioBanderas VladimirKulich DennisStorhøi DanielSouthern
208,JeremyRenner RachelWeisz EdwardNorton ScottGlenn
209,GeorgeClooney ChrisO'Donnell ArnoldSchwarzenegger UmaThurman
210,JimCarrey TaylorMomsen JeffreyTambor ChristineBaranski
211,DennisQuaid JakeGyllenhaal EmmyRossum DashMihok
212,TomCruise DougrayScott ThandieNewton VingRhames
213,GeorgeClooney MarkWahlberg DianeLane JohnC.Reilly
214,IoanGruffudd JessicaAlba ChrisEvans MichaelChiklis
215,SurajSharma IrrfanKhan AyushTandon GautamBelur
216,NicolasCage EvaMendes WesBentley DonalLogue
217,MattDamon AliciaVikander TommyLeeJones VincentCassel
218,CameronDiaz DrewBarrymore LucyLiu BernieMac
219,NoomiRapace MichaelFassbender GuyPearce IdrisElba
220,MichaelJ.Fox GeenaDavis HughLaurie JonathanLipnicki
221,MattDamon JodieFoster SharltoCopley AliceBraga
222,VinDiesel ThandieNewton KarlUrban ColmFeore
223,JoelKinnaman GaryOldman MichaelKeaton AbbieCornish
224,EmileHirsch ChristinaRicci MatthewFox SusanSarandon
225,ReeseWitherspoon PaulRudd OwenWilson JackNicholson
226,TomCruise CameronDiaz PeterSarsgaard ViolaDavis
227,TomCruise MorganFreeman OlgaKurylenko AndreaRiseborough
228,EwanMcGregor NataliePortman HaydenChristensen IanMcDiarmid
229,EwanMcGregor NataliePortman HaydenChristensen IanMcDiarmid
230,JohnGoodman BillyCrystal MaryGibbs SteveBuscemi
231,HughJackman HiroyukiSanada FamkeJanssen WillYunLee
232,LiamNeeson EwanMcGregor NataliePortman JakeLloyd
233,NicolasCage EmmaStone RyanReynolds CatherineKeener
234,ClovisCornillac GérardDepardieu FranckDubosc JoséGarcia
235,NicolasCage AdamBeach PeterStormare NoahEmmerich
236,ChrisHemsworth CharlizeTheron EmilyBlunt JessicaChastain
237,MeganFox WillArnett WilliamFichtner AlanRitchson
238,SandraBullock GeorgeClooney EdHarris OrtoIgnatiussen
239,PierceBrosnan LindaHamilton JamieRenéeSmith JeremyFoley
240,MeganFox StephenAmell WillArnett LauraLinney
241,MilesTeller KateMara MichaelB.Jordan JamieBell
242,BenStiller JakeCherry CarlaGugino RobinWilliams
243,DwayneJohnson AlexandraDaddario CarlaGugino IoanGruffudd
244,PierceBrosnan JonathanPryce MichelleYeoh TeriHatcher
245,MelGibson HeathLedger JoelyRichardson JasonIsaacs
246,GeorgeClooney BradPitt CatherineZeta-Jones JuliaRoberts
247,AngelinaJolie BradPitt VinceVaughn AdamBrody
248,ShaileneWoodley TheoJames KateWinslet AnselElgort
249,LeonardoDiCaprio CateBlanchett KateBeckinsale JohnC.Reilly
250,JackBlack AmandaPeet EmilyBlunt JasonSegel
251,SethRogen JayChou ChristophWaltz CameronDiaz
252,SullivanStapleton EvaGreen LenaHeadey CallanMulvey
253,HankAzaria NeilPatrickHarris JaymaMays SofíaVergara
254,RoseanneBarr JudiDench JenniferTilly SteveBuscemi
255,ShaileneWoodley TheoJames ZoëKravitz MilesTeller
256,HughJackman DakotaGoyo EvangelineLilly AnthonyMackie
257,HankAzaria NeilPatrickHarris BrendanGleeson JaymaMays
258,SandraBullock JasonPatric WillemDafoe TemueraMorrison
259,AsaButterfield HarrisonFord HaileeSteinfeld AbigailBreslin
260,BruceWillis JustinLong TimothyOlyphant CliffCurtis
261,ElijahWood IanMcKellen CateBlanchett OrlandoBloom
262,JackieChan SteveCoogan CéciledeFrance RobertFyfe
263,WillSmith JamieFoxx JonVoight MarioVanPeebles
264,MikeMyers DakotaFanning SpencerBreslin KellyPreston
265,WillSmith BridgetMoynahan AlanTudyk JamesCromwell
266,OrlandoBloom EvaGreen JeremyIrons MartonCsokas
267,MichaelJ.Fox GeenaDavis HughLaurie JonathanLipnicki
268,AnikaNoniRose BrunoCampos KeithDavid Michael-LeonWooley
269,MattDamon JessicaChastain KristenWiig JeffDaniels
270,EwanMcGregor ScarlettJohansson DjimonHounsou SeanBean
271,WarrenBeatty DianeKeaton GoldieHawn GarryShandling
272,NicolasCage AngelinaJolie GiovanniRibisi DelroyLindo
273,RussellCrowe JoaquinPhoenix ConnieNielsen OliverReed
274,TomCruise ColinFarrell SamanthaMorton MaxvonSydow
275,DanielRadcliffe RupertGrint EmmaWatson RichardHarris
276,DanielCraig EvaGreen MadsMikkelsen JudiDench
277,MarkWahlberg TimRoth HelenaBonhamCarter MichaelClarkeDuncan
278,ArnoldSchwarzenegger LindaHamilton RobertPatrick EdwardFurlong
279,ChristianBale JohnnyDepp GiovanniRibisi BillyCrudup
280,DenzelWashington RussellCrowe ChiwetelEjiofor JoshBrolin
281,ArnoldSchwarzenegger JamieLeeCurtis TomArnold BillPaxton
282,DenzelWashington JohnTravolta LuisGuzmán VictorGojcaj
283,RobertDeNiro BenStiller OwenWilson DustinHoffman
284,WillFerrell MarkWahlberg EvaMendes SamuelL.Jackson
285,ArnoldSchwarzenegger JamesCaan VanessaWilliams JamesCoburn
286,JamieFoxx ChristophWaltz LeonardoDiCaprio KerryWashington
287,TomHulce DemiMoore TonyJay KevinKline
288,DavidSpade JohnGoodman EarthaKitt PatrickWarburton
289,SylvesterStallone JasonStatham DolphLundgren BruceWillis
290,NicolasCage DianeKruger JustinBartha SeanBean
291,EdSpeleers JeremyIrons SiennaGuillory RobertCarlyle
292,MaxRecords CatherineKeener LaurenAmbrose JamesGandolfini
293,JoshHutcherson AmandaSeyfried ColinFarrell JasonSudeikis
294,JohnnyDepp AngelinaJolie PaulBettany TimothyDalton
295,ArnoldSchwarzenegger GabrielByrne KevinPollak RobinTunney
296,LeonardoDiCaprio DjimonHounsou JenniferConnelly KagisoKuypers
297,LeonardoDiCaprio JonahHill MargotRobbie KyleChandler
298,ValKilmer TommyLeeJones JimCarrey NicoleKidman
299,CasperVanDien DinaMeyer DeniseRichards JakeBusey
300,TomHanks HalleBerry JimBroadbent HugoWeaving
301,EmilyBarclay AbbieCornish EssieDavis JoelEdgerton
302,HalleBerry BenjaminBratt SharonStone LambertWilson
303,DwayneJohnson IanMcShane JohnHurt RufusSewell
304,JosephGordon-Levitt BrianMurray DavidHydePierce EmmaThompson
305,WillFerrell AnnaFriel DannyMcBride JormaTaccone
306,SylvesterStallone JasonStatham HarrisonFord ArnoldSchwarzenegger
307,EdgarRamírez LukeBracey TeresaPalmer DelroyLindo
308,JamieKennedy AlanCumming TraylorHoward KalPenn
309,ChrisHemsworth BenjaminWalker CillianMurphy BrendanGleeson
310,EddieMurphy RandyQuaid RosarioDawson JoePantoliano
311,MattDamon GregKinnear BrendanGleeson AmyRyan
312,NoahSchnapp BillMelendez VenusSchultheis HadleyBelleMiller
313,SteveMartin CampbellScott BenGazzara RebeccaPidgeon
314,BrendanFraser RachelWeisz JohnHannah ArnoldVosloo
315,LeonardoDiCaprio DanielDay-Lewis CameronDiaz LiamNeeson
316,ShiaLaBeouf JeffBridges ZooeyDeschanel JonHeder
317,NicoleKidman MatthewBroderick BetteMidler GlennClose
318,JoshHartnett EwanMcGregor JasonIsaacs TomSizemore
319,WillFerrell ZachGalifianakis DylanMcDermott JasonSudeikis
320,BruceWillis GaryOldman IanHolm MillaJovovich
321,SarahJessicaParker KristinDavis CynthiaNixon KimCattrall
322,KennethBranagh KevinKline RosiePerez ArmandAssante
323,JohnLeguizamo RayRomano ChrisWedge DenisLeary
324,LilyJames CateBlanchett RichardMadden HelenaBonhamCarter
325,RachelWeisz MarkWahlberg SusanSarandon SaoirseRonan
326,AlbertBrooks EllenDeGeneres AlexanderGould WillemDafoe
327,ElijahWood IanMcKellen ViggoMortensen LivTyler
328,ElijahWood IanMcKellen ViggoMortensen LivTyler
329,JeffBridges JulianneMoore BenBarnes AliciaVikander
330,AngelinaJolie JonVoight IainGlen NoahTaylor
331,JohnnyDepp PaulBettany RebeccaHall KateMara
332,SamNeill WilliamH.Macy TéaLeoni TrevorMorgan
333,JamesFranco FreidaPinto JohnLithgow BrianCox
334,FreddieHighmore Mary-LouiseParker NickNolte SarahBolger
335,BruceWillis JaiCourtney SebastianKoch MaryElizabethWinstead
336,DennisQuaid BillyBobThornton JasonPatric PatrickWilson
337,CraigT.Nelson HollyHunter SamuelL.Jackson JasonLee
338,GeenaDavis MatthewModine FrankLangella MauryChaykin
339,LoganLerman BrandonT.Jackson AlexandraDaddario JakeAbel
340,TommyLeeJones WillSmith LindaFiorentino VincentD'Onofrio
341,TomHanks TimAllen JoanCusack KelseyGrammer
342,DenzelWashington ChrisPine RosarioDawson EthanSuplee
343,ChrisTucker JackieChan ZhangZiyi RoselynSánchez
344,HarrisonFord MichellePfeiffer DianaScarwid JamesRemar
345,BillHader AnnaFaris JamesCaan Mr.T
346,RayRomano JohnLeguizamo DenisLeary QueenLatifah
347,BenStiller KristenWiig PattonOswalt ShirleyMacLaine
348,CameronDiaz LucyLiu DrewBarrymore BillMurray
349,LeonardoDiCaprio MattDamon JackNicholson MarkWahlberg
350,EddieMurphy JackieChan Ming-NaWen LeaSalonga
351,BenStiller JackBlack RobertDowneyJr. NickNolte
352,DanielCraig RooneyMara ChristopherPlummer GoranVisnjic
353,BruceWillis JeremyIrons SamuelL.Jackson GrahamGreene
354,RobertDowneyJr. JudeLaw RachelMcAdams MarkStrong
355,JackHuston TobyKebbell RodrigoSantoro NazaninBoniadi
356,MichaelJ.Fox CoreyBurton ClaudiaChristian JamesGarner
357,JasonLee JustinLong BellaThorne MatthewGrayGubler
358,TomCruise CaricevanHouten KennethBranagh BillNighy
359,AdamSandler JohnTurturro EmmanuelleChriqui NickSwardson
360,AdamSandler MichelleMonaghan PeterDinklage JoshGad
361,HaleyJoelOsment FrancesO'Connor SamRobards JakeThomas
362,EddieMurphy TerenceStamp NathanielParker MarshaThomason
363,JodieFoster MatthewMcConaughey JamesWoods JohnHurt
364,KevinBacon ElisabethShue JoshBrolin KimDickens
365,NicoleKidman SeanPenn CatherineKeener JesperChristensen
366,LoganLerman AlexandraDaddario DouglasSmith LevenRambin
367,AngelinaJolie GerardButler NoahTaylor DjimonHounsou
368,JesseEisenberg WoodyHarrelson MarkRuffalo DaveFranco
369,ValKilmer ElisabethShue RadeSerbedzija HenryGoodman
370,RobertRedford BradPitt CatherineMcCormack StephenDillane
371,GarySinise TimRobbins DonCheadle ConnieNielsen
372,JesseEisenberg AnneHathaway LeslieMann JaneLynch
373,RobinWilliams SamNeill EmbethDavidtz OliverPlatt
374,TommyLeeJones AnneHeche GabyHoffmann DonCheadle
375,HarrisonFord BradPitt MargaretColin RubénBlades
376,HarrisonFord LiamNeeson PeterSarsgaard JossAckland
377,ArnoldSchwarzenegger JamesEarlJones MaxvonSydow SandahlBergman
378,RussellCrowe RenéeZellweger PaulGiamatti CraigBierko
379,ElleFanning NathanLane JohnTurturro FrancesdelaTour
380,JeffBridges DavidMcCullough ChrisCooper TobeyMaguire
381,HelenHunt BillPaxton CaryElwes JamiGertz
382,TomHanks HelenHunt ChrisNoth PaulSanchez
383,ElijahWood RobinWilliams BrittanyMurphy HughJackman
384,MattDamon FrankaPotente BrianCox JuliaStiles
385,HarrisonFord GaryOldman GlennClose WendyCrewson
386,GeorgeClooney BradPitt MattDamon AndyGarcía
387,MillaJovovich OrlandoBloom LoganLerman RayStevenson
388,AdamSandler SteveBuscemi DavidSpade KevinJames
389,AmyAdams PatrickDempsey JamesMarsden TimothySpall
390,DenzelWashington RyanReynolds VeraFarmiga JoelKinnaman
391,GlennClose IoanGruffudd AliceEvans TimMcInnerny
392,BenStiller EddieMurphy CaseyAffleck AlanAlda
393,CameronDiaz KateWinslet JudeLaw JackBlack
394,WillSmith GeneHackman JonVoight ReginaKing
395,MerylStreep AlecBaldwin SteveMartin JohnKrasinski
396,GeorgeClooney BradPitt MattDamon AlPacino
397,MartinLawrence AshtonKutcher GarySinise DebraMessing
398,ShaileneWoodley TheoJames KateWinslet MilesTeller
399,JudeLaw RachelWeisz EdHarris JosephFiennes
400,DwayneJohnson SeannWilliamScott RosarioDawson ChristopherWalken
401,ArnoldSchwarzenegger F.MurrayAbraham ArtCarney CharlesDance
402,ZhangZiyi GongLi YoukiKudoh TsaiChin
403,LucasBlack NathalieKelley SungKang ShadMoss
404,JamesMcAvoy HughLaurie BillNighy JimBroadbent
405,BradPitt AnthonyHopkins ClaireForlani JeffreyTambor
406,ArnoldSchwarzenegger FrancescaNeri EliasKoteas CliffCurtis
407,RoyScheider JessicaLange LelandPalmer AnnReinking
408,JuliaRoberts LilyCollins ArmieHammer NathanLane
409,MichaelCera MaryElizabethWinstead KieranCulkin ChrisEvans
410,AaronEckhart HilarySwank DelroyLindo StanleyTucci
411,EddieMurphy JanetJackson LarryMiller JohnAles
412,FreddiePrinzeJr. SarahMichelleGellar MatthewLillard LindaCardellini
413,KarlUrban OliviaThirlby LenaHeadey WoodHarris
414,AdamSandler KateBeckinsale ChristopherWalken DavidHasselhoff
415,HalHolbrook AdrienneBarbeau FritzWeaver LeslieNielsen
416,JamesMarsden NickNolte ChristinaApplegate BetteMidler
417,HaydenChristensen JamieBell SamuelL.Jackson RachelBilson
418,RonPerlman SelmaBlair JeffreyTambor DougJones
419,JakeGyllenhaal RobertDowneyJr. MarkRuffalo AnthonyEdwards
420,ArnoldSchwarzenegger MichaelRapaport TonyGoldwyn MichaelRooker
421,JimCarrey JenniferAniston PhilipBakerHall CatherineBell
422,SylvesterStallone JasonStatham DolphLundgren EricRoberts
423,TomCruise JonVoight EmmanuelleBéart HenryCzerny
424,JenniferLawrence JoshHutcherson LiamHemsworth WoodyHarrelson
425,BradleyCooper EdHelms ZachGalifianakis JustinBartha
426,MichaelKeaton DannyDeVito MichellePfeiffer ChristopherWalken
427,BruceWillis GarryShandling SteveCarell WandaSykes
428,ChrisSanders DaveighChase TiaCarrere DavidOgdenStiers
429,JuliaRoberts SteveBuscemi JohnCleese OprahWinfrey
430,RobertDuvall TéaLeoni ElijahWood VanessaRedgrave
431,BruceWillis CatherineZeta-Jones AnthonyHopkins HelenMirren
432,AdamSandler ChrisRock BurtReynolds MichaelIrvin
433,JasonLee DavidCross JennySlate AndyBuckley
434,AdamSandler KevinJames ChrisRock DavidSpade
435,SteveCarell AnneHathaway DwayneJohnson AlanArkin
436,JackNicholson DianeKeaton KeanuReeves FrancesMcDormand
437,LeonardoDiCaprio MarkRuffalo BenKingsley EmilyMortimer
438,VinceVaughn ReeseWitherspoon RobertDuvall SissySpacek
439,RobinWilliams EwanMcGregor HalleBerry MelBrooks
440,JohnTravolta NicolasCage JoanAllen AlessandroNivola
441,AdamSandler KeriRussell GuyPearce CourteneyCox
442,TomHanks TylerHoechlin JenniferJasonLeigh LiamAiken
443,AdamSandler JenniferAniston NicoleKidman NickSwardson
444,NicolasCage JohnCusack JohnMalkovich VingRhames
445,ShiaLaBeouf MichelleMonaghan RosarioDawson MichaelChiklis
446,JudeLaw NicoleKidman RenéeZellweger EileenAtkins
447,DenzelWashington GaryOldman MilaKunis RayStevenson
448,RobinWilliams MarciaGayHarden ChristopherMcDonald RaymondJ.Barry
449,LiamNeeson CatherineZeta-Jones OwenWilson LiliTaylor
450,MichaelJordan WayneKnight BillyWest DeeBradleyBaker
451,SteveMartin KevinKline JeanReno BeyoncéKnowles
452,KeanuReeves JenniferConnelly KathyBates JadenSmith
453,MelGibson JuliaRoberts PatrickStewart CylkCozart
454,BradPitt ShiaLaBeouf LoganLerman MichaelPeña
455,HarrisonFord AnneHeche DavidSchwimmer JacquelineObradors
456,DanAykroyd JustinTimberlake AnnaFaris TomCavanagh
457,MattDamon JamesCromwell DanielStudi ChopperBernet
458,KevinJames RosarioDawson SylvesterStallone NickNolte
459,GaryOldman WilliamHurt MattLeBlanc MimiRogers
460,DenzelWashington MerylStreep LievSchreiber JonVoight
461,StephenDillane VictoriaFoyt VanessaRedgrave MichaelBrandon
462,AdamSandler AndySamberg SelenaGomez KevinJames
463,SteveMartin ItzhakPerlman QuincyJones BetteMidler
464,GuyPearce MarkAddy PhyllidaLaw SiennaGuillory
465,CharlizeTheron RadeSerbedzija BillPaxton ReginaKing
466,JohnTravolta HughJackman HalleBerry DonCheadle
467,AntonioBanderas CatherineZeta-Jones AdriánAlonsoBarona JulioOscarMechoso
468,RobinWilliams CubaGoodingJr. AnnabellaSciorra MaxvonSydow
469,AdamSandler PatriciaArquette HarveyKeitel RhysIfans
